mutual,tweet1,type1,tweet2,type2,tweet3,type3,tweet4,type4,tweet5,type5,tweet6,type6,tweet7,type7,tweet8,type8,tweet9,type9,tweet10,type10,rated,p1,c1,p2,c2,p3,c3,p4,c4,p5,c5
TheCalvinCooli1,"Take a civics class. DeSantis has a republican legislature. Trump was fighting democrats and republicans in congress AND the senate. But while DeSantis was in congress and in DC, he voted against the wall twice and voted for TPP. He did a lot, I'd say🤣",reply,"How is stating a fact chasing anyone? You're aware Kansas has NEVER elected a democrat Governor while a Dem was President, right? Guess what? They just did in November. The same state that voted against their abortion referendum. Yes, it matters.",reply,"K Abrams was about 1,000x worse than Biden and people know Biden can't pass most things without the house and senate lol. These aren't comparable. I'll ""show up"" on election day and vote down ticket Republican and write in someone for President. Just like neocons did with Trump.",reply,"He's a weak candidate because of his Congressional record. He will not win AZ considering his stance on social security He won't win PA because he's anti fracking and a climate changer Also, is he like Trump or is he not? Because if he is, why would independents vote for him?",reply,? They haven't even liked each other since 2020 when Massie voted against the stimulus package while Trump was worried about winning elections.,reply,"No, but these people (not REP) are delusional. Democrats overwhelmingly vote for their candidate no matter what. Republicans have an identity crisis between America First candidates and squishy Republicans, which unfortunately leads to MAGA voters and/or moderates not voting.",reply,"Lol, every single thing you named was voted on by congress and the senate EXCEPT infrastructure because democrats refused to bring it to a vote under Trump. So thank you for admitting it's congressmen and senators that suck, which we've been saying for years.",reply,"Trump will be the last GOP candidate I ever vote for until they get their shit together. The GOP has done nothing the past two years except ignore their voters and help democrats pass red flag laws, climate change bs, billions to ukraine, and now talking about amnesty.",reply,"Laura's not in DC first of all.. Secondly, what have you got out of voting republican lately? Codifying gay marriage? Spending billions to ukraine? Passing gun legislation? Approving their climate change bs? Approving Bidens Supreme Court justice?",reply,"I know McConnell is the Senate, but thank God he continues to show us how fucking useless voting for the GOP is. This party is beyond dead without Trump.",reply,0,,,,,,,,,,
TheEDSociety,"📌GREAT NEWS: Democrat Mary Peltola, a former state lawmaker who is Yup’ik, and who would become the first Alaska Native in Congress if elected, is currently LEADING Sarah Palin in the state's ranked-choice voting. Stand by ... NYT, photo",retweet,"Biden has it right. If we lose the House &amp; the Senate in November, Republicans will pass a nationwide ban on abortion. That means Democrats must fight for every seat.",retweet,Democrats are setting up an active shooter alert system because mass shooting survivors taught us how critical real-time info can be. 168 House Republicans said NO to our Amber alert-type warning. They think their political survival trumps our kids' survival — they’re wrong! -NP,retweet,"The U.S. Supreme Court made it easier to own a gun, gave cops the ability to not read Miranda Rights, gave religious schools public funding, and overturned Roe v Wade after 50 years of precedence. Welcome to conservative America. Never vote Republican again.",retweet,"When Republicans have power, they ban abortion, cut billionaires’ taxes and attack LGBT Americans. When Democrats have power, they add jobs, fund veteran care, bring manufacturing home, protect the climate and defend reproductive rights. Which do you think is better for America?",retweet,"If MAGA-Republicans win Congress they’ll fight for Donald Trump. If Democrats win Congress, we will fight for you. That’s what’s on the ballot.",retweet,Why are the Republicans purging hundreds of thousands of voters in Florida and Texas? Why do we still have voting machines that can be hacked with no paper trail? Why won’t the Trump admin spend needed money on election security?,retweet,"Biden's assertion that Trump and extremist Republicans pose a threat to American democracy is, undeniably, true",retweet,"Fuck this illegitimate SCOTUS. Fuck the Republican party that enabled this. And if you don't care that this decision makes women second-class citizens, fuck you too. We don't have the luxury of time--we need to fight NOW. It's Democrats vs. Fascists in 2022. Vote accordingly.",retweet,All 50 Republican Senators opposed a House-passed bill to enshrine a woman’s right to choose the size and timing of her family into law. 49 Democratic Senators sided with a 75% supermajority of the American people who support #RoeVWade. Organize now — and remember in November.,retweet,0,,,,,,,,,,
TheEchoLA,Member when the government made Microsoft give money to a failing company like Apple so it wouldnt be a monopoly? LMK how APPL is doing. No one put money into it and we have no more Apple Computers right????,reply,Being in crypto for quite some time and holding XRP I have been follwing the SEC v Ripple lawsuit. Judge Sarah Netburn is actually holding up US law while almost mocking the SEC. She is a true American hero and I think we will get clarity on all crypto soon.,tweet,"Oxford Demographics According to the most recent ACS, the racial composition of Oxfordwas: White: 96.19%Two or more races: 2.03%Asian: 1.21%Black or African American: 0.56%Native American: 0.00%Native Hawaiian or Pacific Islander: 0.00%Other race: 0.00%",reply,This is what is amazing with . Even their socials make sure cast members are recognized. And the cast members are what make Epcot (center) authentic. Thanks,quote,"so like i understsnd telling people in the heat, drunk people, people 3 hrs into a show but for fans to yell at the artist every slow part, between songs, and while they are sipping water to STAY HYDRATED I needed to know if this was a thing.",reply,"I belueve Dave Grohl played drums in a little known band called Nirvana before he started fighting foo. They should see if he can. Ending my sarcasm. But it WOULD be cool to see Dave drum on the next tour, use a headset to sing, and get someone to play guitar.",reply,"Total bull shit. Those of us that trusted get no vote and basically, if this goes through, lose most of our FLR. Class action lawsuit if this passes 100%.",reply,again so Tebow should quit while a ton of others are just as bad? Use BP and you can check equally as bad players who have done this for decades. Braxton Davidson was a 1st rounder and sub 200 in like A+. Pick a real fight next time.,reply,"In Los Angeles half our restaurants are tip free now and you get yelled at tipping. I also waited tables here 15 plus years ago and only Americans tip. Any tourist never tipped as it is only here we tip. So dont say everybody, say USA natives.",reply,Its not until you look into her stoner ass glazed eyes that you realize she would be on social security if she was a human. But honestly she has taught me how to be caring and a better person.,reply,0,,,,,,,,,,
TheLastRefuge2,"Take a civics class. DeSantis has a republican legislature. Trump was fighting democrats and republicans in congress AND the senate. But while DeSantis was in congress and in DC, he voted against the wall twice and voted for TPP. He did a lot, I'd say🤣",reply,"How is stating a fact chasing anyone? You're aware Kansas has NEVER elected a democrat Governor while a Dem was President, right? Guess what? They just did in November. The same state that voted against their abortion referendum. Yes, it matters.",reply,"K Abrams was about 1,000x worse than Biden and people know Biden can't pass most things without the house and senate lol. These aren't comparable. I'll ""show up"" on election day and vote down ticket Republican and write in someone for President. Just like neocons did with Trump.",reply,"He's a weak candidate because of his Congressional record. He will not win AZ considering his stance on social security He won't win PA because he's anti fracking and a climate changer Also, is he like Trump or is he not? Because if he is, why would independents vote for him?",reply,? They haven't even liked each other since 2020 when Massie voted against the stimulus package while Trump was worried about winning elections.,reply,"No, but these people (not REP) are delusional. Democrats overwhelmingly vote for their candidate no matter what. Republicans have an identity crisis between America First candidates and squishy Republicans, which unfortunately leads to MAGA voters and/or moderates not voting.",reply,"Lol, every single thing you named was voted on by congress and the senate EXCEPT infrastructure because democrats refused to bring it to a vote under Trump. So thank you for admitting it's congressmen and senators that suck, which we've been saying for years.",reply,"Trump will be the last GOP candidate I ever vote for until they get their shit together. The GOP has done nothing the past two years except ignore their voters and help democrats pass red flag laws, climate change bs, billions to ukraine, and now talking about amnesty.",reply,"Laura's not in DC first of all.. Secondly, what have you got out of voting republican lately? Codifying gay marriage? Spending billions to ukraine? Passing gun legislation? Approving their climate change bs? Approving Bidens Supreme Court justice?",reply,"I know McConnell is the Senate, but thank God he continues to show us how fucking useless voting for the GOP is. This party is beyond dead without Trump.",reply,0,,,,,,,,,,
TheRickyDavila,"52% of Republicans say they would support postponing the 2020 election if trump wanted to, according to washington post poll. These people are anti American, anti democracy and unreachable. They have no consistent values. Focus on the 48% and non republicans.",retweet,"I am voting YES on a clean bill to end this shutdown and put 800,000 federal employees back to work. Republicans unanimously supported this plan in December—but now they’re playing politics with people’s lives. Enough. Let’s re-open the government today.",retweet,"Today, Trump was asked about Kim Jong-Un’s history of executing political opponents. Trump defended Kim by saying he was “a tough guy.” Trump can’t conceal his admiration for despots, or his disdain for democratic leaders like Justin Trudeau. And still, Republicans stay silent.",retweet,John McCain is a dying American Republican Hero and he is using his time left on Earth standing up against President Trump. He has no other reason to keep fighting Trump other than the fact that he knows Trump is bad for America. Think about that for a minute.,retweet,How do you speak in politics? By voting! That's true for citizens in elections. And it's true for senators who claim to be deeply troubled by President Trump but provide no meaningful check on his power.,retweet,The media covers Trump’s rallies &amp; gives him free airtime. The media is reluctant to call Trump’s lies what they are—LIES. The media is hesitant to call RussiaGate what it is—a CONSPIRACY. The media is not anti-Trump. The media helped elect him &amp; is helping him stay in power.,retweet,"In light @POTUS Trump revoking clearance of &amp; target his political opponents - posting this handy chart from Levitsky &amp; Ziblatt important book “How Democracies Die” p 23. Check out block 2, Trump does something most days advance himself &amp; erode American democracy",retweet,"If Obama was caught on tape committin' a felony as tonight's tape proves, Democrats would call for his resignation by mornin'. Trump is lucky to be surrounded by a GOP congress as corrupt and immoral as he is. We're gonna vote every one of these scoundrels out in Nov!",retweet,Former Director of National Intelligence James Clapper has unequivocally stated that Russia’s attack on the 2016 presidential election helped elect Donald Trump. America has an illegitimate president who is tearing down Democracy. ALL HANDS ON DECK!,retweet,"The GOP controls 68 of the 72 seats deemed competitive this election. If Democrats turn out in big numbers — IF —and flip at least 24 seats blue, we retake control of the House. That is how we STOP TRUMP. Got the math? Great. Early voting has begun. Let’s do this. #BlueWave",retweet,0,,,,,,,,,,
TheTricksterVT,"After all of those years of Republicans claiming that if we elected Obama, he would declare martial law, what do they have to say now that Donald Trump actually did declare martial law? I said it once and I’ll say it again. This is how Hitler happened. #MARTIALLAW",retweet,"Republicans who stole Supreme Court seat &amp; confirmed another justice 8 days before election when 65 million had already voted, then tried for 2 months to overturn a free &amp; election that culminated in violent coup, don't get to lecture Dems about unity, healing or democratic norms",retweet,@POTUS TN's governor Bill Lee is trying to have us put to death for not being exactly like him. He is refusing federal help over and over to make a show of supporting Trump. Someone must stand up and stop him before they put chains on us and its too late. I'm losing hope.,reply,#PresidentialDebate #Debate2020 Trump said Biden called African Americans super predators..wtf that was Clinton. Did anyone else catch that?,tweet,I love Finneas. And a lot of us are voting for Biden because not voting is a vote for Trump 🤷🏽‍♀️,tweet,The only controversy about Biden saying 10-15% of Americans are bad people is he’s way too low in his estimate. The Trump base is at least 35%. Fuck every single one of them.,retweet,"If Senate Republicans fail to convict Donald Trump, it won't be because the facts were with him or his lawyers mounted a competent defense. It will be because the jury includes his co-conspirators.",retweet,Trump told white supremacists to “stand by” tonight. Please please please please please get yourself to the polls and cast your vote. Don’t let Trump steal this election by discounting mail in ballots. Be there. Vote. It could be your last chance,retweet,The Senate shouldn't vote until the American people do.,retweet,"President Trump’s decision to leave the during a global pandemic alienates our allies, undermines our global leadership, and threatens the health of the American people. Trump needs to reverse this reckless decision immediately.",retweet,0,,,,,,,,,,
TheVampyreWitch,"📌GREAT NEWS: Democrat Mary Peltola, a former state lawmaker who is Yup’ik, and who would become the first Alaska Native in Congress if elected, is currently LEADING Sarah Palin in the state's ranked-choice voting. Stand by ... NYT, photo",retweet,"Biden has it right. If we lose the House &amp; the Senate in November, Republicans will pass a nationwide ban on abortion. That means Democrats must fight for every seat.",retweet,Democrats are setting up an active shooter alert system because mass shooting survivors taught us how critical real-time info can be. 168 House Republicans said NO to our Amber alert-type warning. They think their political survival trumps our kids' survival — they’re wrong! -NP,retweet,"The U.S. Supreme Court made it easier to own a gun, gave cops the ability to not read Miranda Rights, gave religious schools public funding, and overturned Roe v Wade after 50 years of precedence. Welcome to conservative America. Never vote Republican again.",retweet,"When Republicans have power, they ban abortion, cut billionaires’ taxes and attack LGBT Americans. When Democrats have power, they add jobs, fund veteran care, bring manufacturing home, protect the climate and defend reproductive rights. Which do you think is better for America?",retweet,"If MAGA-Republicans win Congress they’ll fight for Donald Trump. If Democrats win Congress, we will fight for you. That’s what’s on the ballot.",retweet,Why are the Republicans purging hundreds of thousands of voters in Florida and Texas? Why do we still have voting machines that can be hacked with no paper trail? Why won’t the Trump admin spend needed money on election security?,retweet,"Biden's assertion that Trump and extremist Republicans pose a threat to American democracy is, undeniably, true",retweet,"Fuck this illegitimate SCOTUS. Fuck the Republican party that enabled this. And if you don't care that this decision makes women second-class citizens, fuck you too. We don't have the luxury of time--we need to fight NOW. It's Democrats vs. Fascists in 2022. Vote accordingly.",retweet,All 50 Republican Senators opposed a House-passed bill to enshrine a woman’s right to choose the size and timing of her family into law. 49 Democratic Senators sided with a 75% supermajority of the American people who support #RoeVWade. Organize now — and remember in November.,retweet,0,,,,,,,,,,
TheViditsharma,"BREAKING: Every single Republican in the Senate just voted against so much as having a discussion about the For the People Act, which seeks to protect our most fundamental right to vote.",retweet,Enough of this bullshit hand wringing. President Biden is dealing with a pandemic where moronic Trump supporters refuse to get vaccinated. And an evacuation of 20 year long failed war. Yet his approval rtg. is still at 50%. The Lying Sociopath was below 50 his entire presidency.,retweet,"""The US House Select Committee investigating the January 6th Capitol riot must conduct a sweeping investigation of all the ways former President Donald Trump interfered with the election,"" @NormEisen writes for @CNNOpinion.",retweet,How Hitler seized power in Nazi Germany: 1. Create a crisis. 2. Demonize opponents. 3. Declare a state of emergency. 4. Undermine elections. 5. Make the rule of law irrelevant. 6. Rule by executive order. If America falls it will be bc of the people who sat on their hands. 02,retweet,"When you see Trump grinning with NYPD &amp; NYFD remember, by not paying his taxes, even applying for STARR deductions in NYC. He didn’t help pay for a single new helmet post 9/11. He is a man who has only taken from the city, never given. I wish the folks he uses would see that.",retweet,"I’m a Democrat running for U.S. Senate in Utah to #UnseatMikeLee. I have 53,300 followers. Can we hit 65k followers? Yes Yes Yes 👇 👇 👇",retweet,"There's a really easy way to pay for all the programs in Joe Biden's infrastructure plans. TAX THE RICH. TAX THE RICH. TAX THE RICH. The ultra wealthy are hoarding resources. They're not job creators-they are dogs in the manger, working to keep wages low. #FTPA",retweet,Photos of some of the protesters who were murdered by cops. A few of them are under 18. We are fighting a state that kills children. Doesn't it familiar with what Israeli fascist state do against Palestinians? Shame on you if you get angry of Israeli state but not Iran state.,retweet,"There are many ways to get involved in supporting bat conservation, from building a bat box, joining your local bat group or raising funds for bat conservation, take a look at our website to explore some ideas",retweet,Boris Johnson: UK Government and MOD Help Nowzad rescue get the workers and animals out of Afghanistan now! - Sign the Petition! via,retweet,0,,,,,,,,,,
Theyouthcompany,UCI’s grad student government has been trying to email grad students FOR WEEKS about their right to strike. Admin blocked those emails. They also blocked an email of support from the undergrad student government. Their reason? The content is “political.” It gets worse.,retweet,Why I'm voting No - a thread. TLDR: this contract does not solve most of the problems that brought us out on the picket line in the first place.,tweet,"#USA joins long list of countries that prioritizing #BuildBackBetter in male-dominated sectors &amp; ignoring sectors like health, education &amp; care-work, which are women-dominant. I'm not the only person making this point, but I do have a primer in @WPReview.",retweet,"I'm presenting an iPoster on 9/30 from 11-11:30am PDT entitled ""Negotiating Women's Representation"" on the effects of local women's active participation in peace negotiations on women's political representation in post-conflict states.",reply,"Literally every person I meet: What are you studying? Me: Political science Them: So, whaddya think about this Afghanistan mess? Me:",tweet,"When UC makes it impossibly expensive to be a scientist &amp; live in CA - low wages, no childcare, no housing - it forces out everyone who lacks family money (especially Black/Latine ppl, bc racism). It imposes a poll tax on going into science. And that makes our science worse. 6/",retweet,"If you are a political scientist and think it is an outrage that the Claremont Institute has invited coup architect John Eastman to the APSA annual meeting, please read and consider signing this open letter to the APSA Council: #APSA2021",retweet,"We hear that President Drake - who earns $1m and lives in a house worth $6.5m - will announce that those on strike, including faculty, will have pay docked for demanding that everybody should be able to afford to go to graduate school. That's why we need #FairUCNow",retweet,"But regardless of how you vote, we hope there’s one thing you can take away from this strike: Screw the UC and screw the neoliberal capitalist, racist, ableist, heterosexist, nationalist model of education. Regardless of the contract vote outcome, this fight isn’t over.",retweet,"Respectfully, I will be voting no on this TA. Here’s why: All things being equal, we should ratify a contract based on whether it meets our needs, or we believe that we can’t build the power necessary to win more. Neither of these conditions have been satisfied in my view.",retweet,0,,,,,,,,,,
TimHannan,@FoxNews WaPost... lol... a liberal poll clearly. Include Trump supporters and the number is closer to 50% because 90% of them will never accept Joe Biden as their president no matter what. After Trump poisoned politics so badly they may never view a Democrat legitimately again.,reply,He's a president largely impervious to voting and elections and public sentiment. Very much in the tin-pot mold like they have in Turkey and in Russia and what we would have had here if Trump had managed to maintain power beyond one-term.,tweet,@hodgetwins Well since Trump was president in 2020 when this alleged interference occurred maybe impeachment if he ever wins office again but that seems unlikely as he's yet to garner the most votes in any election and Republicans can't always count on the electoral college bailing them out.,reply,Breaking: Democratic incumbent and crucial 50th vote for federal judges Catherine Cortez Masto has assumed a 5k vote lead in Nevada. In the 20 some years I've been following politics closely I've not seen an election quite like this. Simply miraculous.,tweet,"Iowans don't want or need a government handout. If you had any principles you'd return this communistic, neo-marxist, socialist tax &amp; spend money we can't afford back to the liberal states like Calif. &amp; NY that provide the majority of federal funds to keep flyover country afloat!",reply,Republicans are drastically altering election laws to make voting as difficult and painful a process as possible. All in service of the #BigLie and to placate Donald Trump and his fanatical following who may never come to grips with his decisive loss.,tweet,Major League Baseball disavows failed one term president toxic Trump rejects suggestion they asked him to attend World Series game in a state where he lost to Joe Biden and also helped elect two Democratic Senators.,tweet,@WalshFreedom Has this doofus forgot Benghazi ran 5 years and spanned 2 elections only ending when a Republican was voted in. I'd like to see Trump or one of his puppets testify for 11 hours straight. Even if they appeared they'd necessarily plead the 5th to avoid self-incrimination.,reply,They say elections have consequences but apparently that doesn't apply to GOPers. With three Trumper activist judges residing the Trump State is still deciding things even with a Democratic President and Congress.,reply,Not a single one of Biden's U.S. Attorneys have taken office. The 'Trump state' operates unabridged as Democrats attempt to play patty cake with recalcitrant Republicans. And you wonder why there's been no indictments?,retweet,0,,,,,,,,,,
