mutual,tweet1,type1,tweet2,type2,tweet3,type3,tweet4,type4,tweet5,type5,tweet6,type6,tweet7,type7,tweet8,type8,tweet9,type9,tweet10,type10,rated,p1,c1,p2,c2,p3,c3,p4,c4,p5,c5
RyanGarciaESM,"DESANTIS RESPONDS TO TRUMP ATTACKS: ""I roll out of bed, I have people attacking me from all angles [...] In my case, not only did we win re-election, we won with the highest percentage of the vote than any Republican governor candidate in the history of the state of Florida.""",retweet,"President Trump outlines his new education plan, which includes: ➡️ Eliminating federal funding for schools that push critical race theory or left-wing gender ideology. ➡️ Direct elections of principals by the parents. ➡️ Banning men from women's sports.",retweet,"If re-elected, Donald Trump says he will sign an Executive Order on his first day of presidency that orders federal agencies to cease all programs promoting medical procedures for trans Americans, “at any age.”",retweet,"Social media sites banned Trump for promoting the idea that the election was stolen. Not for sending threats to anyone. Not for posting lewd or obscene material. But for expressing a belief he had. We gotta stop lying to ourselves about this ""free speech"" stuff. Lol",retweet,"WATCH: President Trump promises to dismantle the deep state. ""We will use every tool at our disposal to defend election integrity, and we will dismantle the illegal censorship regime and bring back free speech to America.""",retweet,"“We’re going to reverse every single crisis, calamity, and disaster that Joe Biden has created and bring safety, prosperity, and prestige back to America.” - President @realDonaldTrump Watch Our Coverage Of President Trump’s SC Speech here:",retweet,"TRUMP: I want to do the right thing for the American people, and to be honest, secondarily, I want to do the right thing for the world. Don’t forget, we're a very powerful nuclear country, and so are they [Russia]. There's no upside.",retweet,"Not gonna lie…President Trump must REALLY love this country. If I were a 77-year-old, multi-billionaire who spent the last decade being slaughtered and slandered by the media, the last thing on my mind would be to run for presidency and try to save America—again.",retweet,Donald Trump says if he is re-elected he will bring back public executions and air them on live TV. Do you support this?,retweet,"110,236 Americans died from Fentanyl OD’s in 12 months per @FBI says 455 Americans were killed with a rifle in 1 year and not all were AR-15’s. @FBI says 662 were killed with hands, fists or feet during that time period. Democrats only discuss 1 of these. Why?",retweet,0,,,,,,,,,,
SayItAintTed,I already know Biden and Dems are cooked in November. I truly do not care about Republicans taking over either chamber of Congress because it’s bound to happen with how the economy is doing. My focus is on state and local politics.,tweet,This honestly has started long before the pandemic. As soon as Trump was elected so in 2017 I started seeing more states with Republican governors feel empowered to restrict abortion. Once this ruling is official this will empower them even more.,quote,I’m tired of people saying Black people don’t know how to vote when we BAILED out Democrats during the midterm elections. There would be no democratic majority in the Senate if it wasn’t for Black people in Georgia!,tweet,Hmm a white woman saying this as if most white women didn’t vote for Trump in 2016 AND 2020. I think you should talk to your community that routinely votes against their own interests.,quote,While this isn’t wrong that Trump election still has so many consequences. Checks and Balances exist in this country. Congress had countless opportunities to codify Roe V Wade yet they didn’t.,quote,There were quite a bit of Republicans complaining about the shortage and blaming Biden yet only 12 of them voted yes?,quote,"You can register to vote on Election Day in the following states: CA, CO, CT, HI, IA, ID, IL, MD, ME, MI, MN, MT, NH, NM, NV, UT, VA, VT, WA, WI, WY + Washington, D.C. (and ND does not require voter reg)",retweet,I’m not listening to any white women shaming third party voters in 2016. Most of your demographic voted for Trump in 2016 and 2020. Talk to your gals!,tweet,We vote for Dems and they apply ZERO pressure to get things passed. The John Lewis Voting Rights Act is just sitting in Congress. Wait too long and watch when Republicans pass their own voter suppression laws in the new Congress real quick!,reply,"The woo me I already paid off my debt is crazy. Ideally Biden would have reduced interest rates to zero but that’s beyond his scope as President, only Congress can do that. Senate Republicans and Manchin would NEVER let a bill pass beyond the house.",tweet,0,,,,,,,,,,
SeanMcDermott14,"@jaketapper As a libertarian, I can't decide who is worse. The Republicans who are blindly following the Orange Man and justifying his comments &amp; actions or The Democrats who ignore the stupid comments &amp; actions of members of their own party by claiming that they're not as bad as Trump.🤣",reply,"Looking into it is one thing. How many challenges has Trump actually won? If the GOP doesn't vote in January as some kind of protest, there will be 2 more Democratic senators voted in. And a 50-50 deadlock in the Senate is broken by VP Harris. Not voting is bad strategy.",tweet,"Desantis. Not even close. I don't think Trump is electable, for one. If he wasn't able to win as an incumbent against Biden, he isn't going to win in 2024. He's also just too divisive at this point. He won't get anything done, short of enacting executive orders.",reply,"I would hope that Republicans and Democrats are also anti-violence, so I'm not sure what your point is? Libertarians are about self-reliance, though. Owning a firearm for self-defense is part of self-reliance, especially now after you've got dems calling for defunding police.🙄",tweet,"This isn't a new thing. 🙄 H. Clinton was elected senator after only being MARRIED to a president for 8 years. Obama was elected president after being a JUNIOR senator in Illinois for less than 1 term. Trump was elected after only being a PT businessman &amp; reality TV ""star.""",reply,"Yep. Even if you recognize the craziness and instability of the Trump years, it's still ok to be unhappy with the way our country is currently being governed.🙄 Biden is obviously cognitively impaired and the Dems are spending our country's money like it's monopoly money.",reply,"@KamalaHarris Nope. I didn't vote for Trump either time. I voted 3rd party. I'm not a fan of Trump, Clinton or Biden. But that's obviously your go-to defense - ""But Trump did something that was far worse."" Trump has nothing to do with Kamala being an actual political whore. Both are awful.",reply,"Dear God, anyone is better than Trump. I still can't believe that he was elected in 2016. I voted 3rd party in the last 2 pres elections, because I just couldn't convince myself to vote for either of the major 2 candidates. The U.S. is just a hot mess right now...",reply,"I'm sure that as much as he hates Trump, Romney realizes that his support will evaporate among his Mormon constituency in Utah if he opposes installing another conservative justice prior to the election. It's not exactly complicated...",reply,"This! I can't believe the number of people who rip on all of the people who supported Trump (not without merit) and then completely ignore the fact that they themselves voted for Biden. Come on. We replaced a narcissistic reality TV ""star"" with a cognitively disabled old man.🤣",reply,0,,,,,,,,,,
SemanticsGrp,Retweet if you're a principled conservative who will never support a Republican Senator who votes to acquit Trump. Let's show them we're watching.,retweet,"“Haley is in the same position as all these other Republicans who jumped on the Trump Train,” said Chip Felkel, a longtime South Carolina GOP strategist. “Some of this shit, you can never get clean from it. People will remember.”",tweet,Donald Trump running for President again? I was the one walking over broken glass at 4 a.m. after the Jan. 6th insurrection with pages carrying the mahogany boxes of electoral ballots. Democracy prevailed that day. We will not go backwards and descend into his chaos again.,retweet,Why the Whole Trump-Clinton Election Could Probably Just Be Held in Pennsylvania,tweet,President Trump Makes Special Long-Distance Call to Record Breaking American Astronaut via NASA,tweet,Brutal Hillary Clinton montage uses GOP rivals' attacks on Donald Trump against him via,tweet,Sounding Code Red: Electing the Trump Resistance via @NYTimes,tweet,What Trump's been saying about the judge in his Trump U case is disgusting. Just ask Republicans.,retweet,"I think if the Trump-inspired terrorists repeat their attacks on America next weekend, then failing a strong disavowal from Trump, they may very well guarantee a guilty verdict for the imminent impeachment.",tweet,A shameless family of thieves. Melania Trump’s Speech steals from Michelle Obama’s in 2008,tweet,0,,,,,,,,,,
Serendi2001,"Please rt. A group of students in Louisiana were told they were going to a college fair and were taken to an anti-LGBTQ+ church service. The girls were told that they should forgive their abusers, the boys were forced to do push-ups in the smoldering heat with no water. Trans +",retweet,"announcing ticket sales 4 days before the date, only 2 shows announced in america so far after 9 months of waiting, multiple articles saying they would tour 6-7 cities AND multiple countries, 127 touring 4 countries in EIGHT months 😭 this is the messiest tour",retweet,"If the US is really worried about variants and the spread of COVID through travel, it should require negative tests for all travelers, no matter where they come from, and require masks. Targeting single countries with bans and requirements is ineffective and racist.",retweet,TW: Infant Mortality A pregnant Black Women is in URGENT need after contracting COVID. She’s already high risk and needs extra time to heal but doesn’t have the funds to take time off work. PLEASE DO NOT IGNORE THIS IF YOU HAVE A HEART. BW have high pregnancy mortality rates.,retweet,sometimes people do not answer by raising their hand because they are afraid of sounding stupid or speaking incorrectly or social anxiety . small group discussions may work better for people to speak their opinions,retweet,"Those saying that walking out of a whitecoat ceremony to protest a vocally anti-abortion speaker is ""unprofessional"" are the same people who help anti-abortion people get and maintain positions of power. ""Professionalism"" maintains status quo which never serves the oppressed.",retweet,ICE is on the scene of a shooting that took place in a heavily Hispanic school so undocumented parents have to consider arrest deportation before they go check to see if their kids are alive. What a fucking country.,retweet,40% of teen pregnancies in 15 y/o girls involve a fathering man who is 20-29. It is never lost on me that the conversations surrounding teen pregnancy are always about the promiscuity of teenage girls and not the violence of older men,retweet,"Over $300,000 was raised in 1 day for the 17 yr old sex trafficking victim ordered to pay 150,000 to the family of the man who sexually violated her. I bet the Iowa judge responsible for that sentence is shooketh. Their aim was to criminalize &amp; stigmatize her 4 life. They failed.",retweet,"I think the funniest thing about this tweet is the idea that if Black people were nicer, we’d get reparations. The fact that we havent blown up the Royal Palace, the White House or any other symbols of our oppressors is extremely nice of us, we are VERY nice to you people.",retweet,0,,,,,,,,,,
SheabuttrPapi,I already know Biden and Dems are cooked in November. I truly do not care about Republicans taking over either chamber of Congress because it’s bound to happen with how the economy is doing. My focus is on state and local politics.,tweet,This honestly has started long before the pandemic. As soon as Trump was elected so in 2017 I started seeing more states with Republican governors feel empowered to restrict abortion. Once this ruling is official this will empower them even more.,quote,I’m tired of people saying Black people don’t know how to vote when we BAILED out Democrats during the midterm elections. There would be no democratic majority in the Senate if it wasn’t for Black people in Georgia!,tweet,Hmm a white woman saying this as if most white women didn’t vote for Trump in 2016 AND 2020. I think you should talk to your community that routinely votes against their own interests.,quote,While this isn’t wrong that Trump election still has so many consequences. Checks and Balances exist in this country. Congress had countless opportunities to codify Roe V Wade yet they didn’t.,quote,There were quite a bit of Republicans complaining about the shortage and blaming Biden yet only 12 of them voted yes?,quote,"You can register to vote on Election Day in the following states: CA, CO, CT, HI, IA, ID, IL, MD, ME, MI, MN, MT, NH, NM, NV, UT, VA, VT, WA, WI, WY + Washington, D.C. (and ND does not require voter reg)",retweet,I’m not listening to any white women shaming third party voters in 2016. Most of your demographic voted for Trump in 2016 and 2020. Talk to your gals!,tweet,We vote for Dems and they apply ZERO pressure to get things passed. The John Lewis Voting Rights Act is just sitting in Congress. Wait too long and watch when Republicans pass their own voter suppression laws in the new Congress real quick!,reply,"The woo me I already paid off my debt is crazy. Ideally Biden would have reduced interest rates to zero but that’s beyond his scope as President, only Congress can do that. Senate Republicans and Manchin would NEVER let a bill pass beyond the house.",tweet,0,,,,,,,,,,
SickPuppies,@POTUS And republicans actually believe that an appeal in the senate magically means Trump is no longer impeached...like magic..😂,reply,"Our response to Mr. Trump's inauguration has to be to fight back for economic, social, environmental &amp; racial justice. We're not giving up!",retweet,"Lone cyclist responds to @POTUS motorcade shortly after departing Trump National Golf Club in Sterling, Va. (Photo: /)",retweet,"Stop using Trump's framing about the ""opening the economy."" Here's what he is really doing: - going against the advice of medical experts and local officials - forcing workers to choose between their health and a paycheck - Repealing CDC guidelines with no plan",retweet,"Obama decided last year to let trans people serve openly, effective July 1. Trump delayed the implementation, now reversing the policy.",retweet,"I hear you, Sanders supporters who plan to vote Trump. One time I asked for Coke but they only had Pepsi, so I set fire to my head.",retweet,"My brother hates Obama yet he's so pro-Trump, he posted a video from 2008 of him campainging against her. Makes no sense.",tweet,"""Trump 2020. Make the liberals cry again."" Oh whoops. Seems like your car mysteriously caught fire there, bud.",tweet,How Donald Trump handles protesters vs how Barack Obama handles protesters. via @YouTube,retweet,"@danpfeiffer Why Trump wants the country to ""reopen"" ASAP: His properties are losing $1 million a day. He hasn't golfed for five weeks. He hasn't held a rally since March 2.",retweet,0,,,,,,,,,,
Side420Dark,There is a bill in the Senate that would stop Trump's policy of separating immigrant children from their parents at the border. There are currently 43 Democratic co-sponsors and ZERO Republicans. Every single Senator who is not a sponsor needs to confronted about it Let's go,retweet,Donald Trump and Republicans just celebrated voting to let thousands of Americans die so that billionaires get tax breaks. Think about that.,retweet,"Biden, slamming Trump's bogus claims of fraud and GOP lawmakers who backed Texas lawsuit, notes his election win survived Supreme Court challenge: ""Now it's time to turn the page... to unite, to heal.""",retweet,Images of members of Congress who have enabled Trump during this pandemic getting vaccinated before Americans receive covid relief shows just how deformed Washington has become.,retweet,"Wait a minute, wait a minute--did Trump just basically endorse an alleged child molester because he's a conservative and will vote for his tax bill?",retweet,"""If public opinion does not demand change in Congress, it will not change."" - President Obama on...",tweet,"Okay, Republicans. How much longer are you going to let this farcical “presidency” continue? At a time of such political, economic, and geo-strategic turbulence—both nationally and globally—are you waiting for a catastrophe to happen before acting? Disaster looms!",retweet,"All politics aside, the Trump administration reminds me of that Tom Arnould movie, THE STUPIDS. Really, you guys, this is embarrassing.",retweet,Donald Trump has spent years peddling lies about President Obama. And that didn't stop today.,retweet,"I hope our Government will condemn far-right retweets by Donald Trump. They are abhorrent, dangerous and a threat to our society.",retweet,0,,,,,,,,,,
Sneakyone75,"This is why Democrats try so hard to portray Republicans as people who want to eliminate all LGBT people, remove all taxes ever, and actual nazis. Because they want the ""well at least they're not nazis"" vote since they can't get the actual ""i trust them to do what they say"" vote",reply,"Assuming you're not American because yes. Haven't you seen those posts from people saying ""I voted for Biden because Republicans want me dead""?",reply,"Honestly it seems like people forget that the Republican party didn't even exist until around 80 years after the country was established. A vote for a party that isn't Dem or GOP is just that. Nothing more, nothing less.",reply,Those are the kind of people who said they would move to Canada if trump got elected but didn't.,reply,"I'm sorry, could you provide a source for that? In the last 4 years I don't remember Trump installing a dictatorship or creating concentration camps (the border camps existed under Obama, so no that doesn't count)",tweet,I really hope so. I keep seeing people I thought were reasonable unironically state that JK Rowling directly kills trans people by existing. It's a repeat of Trump hysteria during that election and it's tiresome.,reply,Kind of reminds me of trump getting elected tbh. People crying and shitting themselves over a Harry Potter game wasn't something I expected tbh,reply,"Saying One Piece is anti-government is projection at best. Luffy beats up anyone who hurts his friends. Regardless if they're marines or other pirates. Not to mention times they help the government of the island or work with marines (Alabasta, Punk Hazard, Zou, etc).",reply,Unfortunately being right isn't enough for people to not state their disapproval of Trump any time he says something.,reply,I'd say it's more like Republicans have standards that aren't good and Democrats have no standards at all.,reply,0,,,,,,,,,,
SoCalValleyGal,"We now live in a country where most the Republicans and Democrats in Washington D.C. care more about Ukraine than the USA. These out-of-touch neocon warmongers have no idea how pissed off the American people are over their Ukraine first, America last bullshit.",retweet,"Biden: liar, pedophilic tendencies, horrible father, cheats on his wife, cares only about Ukraine, will not be re-elected President Trump: loves America, great father, excellent president, big heart, will be president again",reply,"Are you crazy? Of you are, you’re a leftist. The biggest story is the FBI and the MEDUA covered up the Hunter Biden story, because THEY KNEW, Biden wouldn’t win. The election was stolen. Trump was right AGAIN.",tweet,"No. Biden goes to continue the Ukraine grift, Trump goes to Ohio to see what can be done. Biden does not care about Americans",reply,@joncoopertweets Not a threat. Do you even know what a threat is? Here’s a real threat. Biden attempting to harm 70% of the country because they like Trump.,reply,"The Democrats have settled on their closing argument: ""Vote for us so that we can castrate children, use your money to pay for abortions, and put pornography in the schools. If you don't vote for us then you are a Nazi and democracy will die."" Fascinating political strategy.",retweet,One thing is clear: Republicans in congress are more aligned with Democrats than their voters.,retweet,@GeraldoRivera Be quiet. At least half the country cares. Stop telling us what to think or believe. There is no way they can go after Trump now without going after Biden. None.,reply,"He was/is hated, but it has zero to do with him being 1/2 black. Trump had more Hispanics and blacks vote for him then any republican nominee before him. He is anything but racist. Obama was the biggest racist President in history",reply,@catturd2 @POTUS Donald Trump did make our lives better. America first is the most important Political statement anyone can make. The Biden regime believes America last. Everything in America is last to him he’s done,reply,0,,,,,,,,,,
Sobyvee,"The GOP blamed Obama when 4 Americans died in Benghazi They were outraged about a death toll of 4. The pandemic death toll? 108,000. The GOP response? Endless praise for Trump. Craven assholes. #NoJusticeNoPeace Weather Underground Glenn Beck ATTACK AND DETHRONE GOD Lady G",retweet,"@thebradfordfile @realDonaldTrump if it was voting fraud, as claimed, why didn't democrats win more local and state seats? republicans still won most of those. so that claim isn't even logical.",reply,"I'm a moderate, [slightly leaning liberal], but not a Democrat. I don't personally think trump is the cause of racism; that's part of many individuals culture, and has been so for a very long time, even if the individual doesn't realize it",reply,"yesterday Congress Republicans issued a war against women. Is there a way to know who asked to overturn wade vs rowe, for ease in voting them out next term?",reply,@thebradfordfile @realDonaldTrump why would Biden need to cheat? I can't imagine it being possible for more than 15-20% of the US population to vote for trump. We've already seen him fail at everything for four years.,reply,"it's frustrating because I, too, would rather vote green. I don't like the idea that my vote is more necessary to take away from opposition, than it is to empower a party that I'm more aligned with. I don't like biden, but I have more dislike for trump",tweet,"yea, well, you were a kid when all this occurred. perhaps if people your age started getting into some understanding of politics and voted in every election instead of just presidential ones, you might one day make it better. until then, that zone is a piece of shit.",reply,"people are shamed socially when they talk about voting for a third party, yet the shamers themselves probably can't define what their party definitions are. wouldn't be at all surprised if more than half of them supported a party that had nothing to do with them",reply,"@realDonaldTrump if people regularly voted every single time they had a local or state election, their votes would have greater impact, instead of only voting during presidential elections. but if the mainline media outlets like the local news (which people with netflix don't watch anyway..)",reply,"in the 2016 election I voted green (and usually do so in local, too) mostly to give a bit more push towards the green party, even though I know they aren't likely to win. I've been yelled at about how a vote for neither main party is a vote for the one that ends up winning",reply,0,,,,,,,,,,
