mutual,tweet1,type1,tweet2,type2,tweet3,type3,tweet4,type4,tweet5,type5,tweet6,type6,tweet7,type7,tweet8,type8,tweet9,type9,tweet10,type10,rated,p1,c1,p2,c2,p3,c3,p4,c4,p5,c5
NoVAhouse4sale,"Donald Trump, Hillary Clinton or the Dali Lama? It’s Not The Messenger That Matters to The Markets",tweet,Boomers are considering #retirementdestinations where they can live well. Learn the states that offer lower tax rates by not taxing pension or Social Security income as well as the most affordable counties for #retirement #retirementplanning,tweet,GOP’s Frictions are Impacting Timing and Magnitude of Trump Plans,tweet,U.S. Dollar Plummets – President Trump Says Gains Will Hurt America,tweet,"Considering the rise in social security scams, be aware of smart strategies to keep your personal information out of the hands of criminals who want to exploit the government and seniors. #socialsecurity #socialsecurityscams #avoidscams",tweet,Trump Apes Argentina Strategy: Bad For Vanguard Long-Term Bond ETF (BLV)?,tweet,Breaking Bond News: Long-dated UST Yields Edge Higher on Trump Promise,tweet,President Trump Goes Too Far and Twitter Bites Back (NYSE:TWTR),tweet,"Most seniors who are already taking their social security benefits will be automatically enrolled in Medicare Part A. But, what does Medicare Part A cover and how do you enroll in it? #medicare #healthcare #seniorhealth #seniorliving #babyboomers",tweet,Trump Immigration Ban Blasted by Tesla (TSLA) and Apple (AAPL) CEOs,tweet,0,,,,,,,,,,
NovElection2024,@FoxNews WaPost... lol... a liberal poll clearly. Include Trump supporters and the number is closer to 50% because 90% of them will never accept Joe Biden as their president no matter what. After Trump poisoned politics so badly they may never view a Democrat legitimately again.,reply,He's a president largely impervious to voting and elections and public sentiment. Very much in the tin-pot mold like they have in Turkey and in Russia and what we would have had here if Trump had managed to maintain power beyond one-term.,tweet,@hodgetwins Well since Trump was president in 2020 when this alleged interference occurred maybe impeachment if he ever wins office again but that seems unlikely as he's yet to garner the most votes in any election and Republicans can't always count on the electoral college bailing them out.,reply,Breaking: Democratic incumbent and crucial 50th vote for federal judges Catherine Cortez Masto has assumed a 5k vote lead in Nevada. In the 20 some years I've been following politics closely I've not seen an election quite like this. Simply miraculous.,tweet,"Iowans don't want or need a government handout. If you had any principles you'd return this communistic, neo-marxist, socialist tax &amp; spend money we can't afford back to the liberal states like Calif. &amp; NY that provide the majority of federal funds to keep flyover country afloat!",reply,Republicans are drastically altering election laws to make voting as difficult and painful a process as possible. All in service of the #BigLie and to placate Donald Trump and his fanatical following who may never come to grips with his decisive loss.,tweet,Major League Baseball disavows failed one term president toxic Trump rejects suggestion they asked him to attend World Series game in a state where he lost to Joe Biden and also helped elect two Democratic Senators.,tweet,@WalshFreedom Has this doofus forgot Benghazi ran 5 years and spanned 2 elections only ending when a Republican was voted in. I'd like to see Trump or one of his puppets testify for 11 hours straight. Even if they appeared they'd necessarily plead the 5th to avoid self-incrimination.,reply,They say elections have consequences but apparently that doesn't apply to GOPers. With three Trumper activist judges residing the Trump State is still deciding things even with a Democratic President and Congress.,reply,Not a single one of Biden's U.S. Attorneys have taken office. The 'Trump state' operates unabridged as Democrats attempt to play patty cake with recalcitrant Republicans. And you wonder why there's been no indictments?,retweet,0,,,,,,,,,,
OGYoungfrag,"Following Stefan's passing, you can help in the battle against cancer by donating to any of these charities American Cancer Society: Cancer Research Institute: Cancer Research UK: (meme from /r/dankmemes)",retweet,"To all gamers, we appreciate all your blessings to his survival after random gunfire. With Eric’s encouragement, now, MSI promises to donate $1 for every retweet this tweet receives up to $10K towards anti-violence charity. #BulletProofMonitor #OptixMonitor",retweet,"This is stupid to complain about tbh. We have mice w/ full control + Keyboards for better movement. They get assistance in aiming. They'd legit not be able to play without it. Which isn't fair to say about most console players, we have more advantages tbh. Plus he missed a lot..",retweet,dude they stormed the US Congress,reply,Just a reminder that ketchup is the best condiment and I won’t accept any other answers here because there are none and if you dare say any condiment that is white whether it be mayo or ranch or blue cheese then you’re blocked on sight anyways good day to you all,retweet,They got us in the first half not gonna lie,reply,"RT for a chance to win: 🛒 36,000 FIFA Points ⚽ North London Derby Tickets #ScoreMoreWithXbox #Sweeps. Open to 48 US/DC 18+ only. Void in NY, FL. Ends on 10/31/19. Rules:",retweet,🔥 #GFUEL x GIVEAWAY 🔥 30 Winners will receive a crap ton of G FUEL!!!! Go to the link below to enter!!! Help us win the fight against T-Series!!!! ENTER HERE: 👈👈👈👈,retweet,RT to donate $5 in Xbox products as part of #GiveWithXbox! 🎮 Join us in helping level the playing field for gamers with disabilities. Learn more:,retweet,IF KSI LOOSES THE REMATCH AGAINST LOGAN PAUL ILL GIVE EVERYONE THAT RT’IS THIS A 5$ GIFTCARD,retweet,0,,,,,,,,,,
OUTR0BLUE,"Please rt. A group of students in Louisiana were told they were going to a college fair and were taken to an anti-LGBTQ+ church service. The girls were told that they should forgive their abusers, the boys were forced to do push-ups in the smoldering heat with no water. Trans +",retweet,"announcing ticket sales 4 days before the date, only 2 shows announced in america so far after 9 months of waiting, multiple articles saying they would tour 6-7 cities AND multiple countries, 127 touring 4 countries in EIGHT months 😭 this is the messiest tour",retweet,"If the US is really worried about variants and the spread of COVID through travel, it should require negative tests for all travelers, no matter where they come from, and require masks. Targeting single countries with bans and requirements is ineffective and racist.",retweet,TW: Infant Mortality A pregnant Black Women is in URGENT need after contracting COVID. She’s already high risk and needs extra time to heal but doesn’t have the funds to take time off work. PLEASE DO NOT IGNORE THIS IF YOU HAVE A HEART. BW have high pregnancy mortality rates.,retweet,sometimes people do not answer by raising their hand because they are afraid of sounding stupid or speaking incorrectly or social anxiety . small group discussions may work better for people to speak their opinions,retweet,"Those saying that walking out of a whitecoat ceremony to protest a vocally anti-abortion speaker is ""unprofessional"" are the same people who help anti-abortion people get and maintain positions of power. ""Professionalism"" maintains status quo which never serves the oppressed.",retweet,ICE is on the scene of a shooting that took place in a heavily Hispanic school so undocumented parents have to consider arrest deportation before they go check to see if their kids are alive. What a fucking country.,retweet,40% of teen pregnancies in 15 y/o girls involve a fathering man who is 20-29. It is never lost on me that the conversations surrounding teen pregnancy are always about the promiscuity of teenage girls and not the violence of older men,retweet,"Over $300,000 was raised in 1 day for the 17 yr old sex trafficking victim ordered to pay 150,000 to the family of the man who sexually violated her. I bet the Iowa judge responsible for that sentence is shooketh. Their aim was to criminalize &amp; stigmatize her 4 life. They failed.",retweet,"I think the funniest thing about this tweet is the idea that if Black people were nicer, we’d get reparations. The fact that we havent blown up the Royal Palace, the White House or any other symbols of our oppressors is extremely nice of us, we are VERY nice to you people.",retweet,0,,,,,,,,,,
Oliver_Murray15,"@jaketapper As a libertarian, I can't decide who is worse. The Republicans who are blindly following the Orange Man and justifying his comments &amp; actions or The Democrats who ignore the stupid comments &amp; actions of members of their own party by claiming that they're not as bad as Trump.🤣",reply,"Looking into it is one thing. How many challenges has Trump actually won? If the GOP doesn't vote in January as some kind of protest, there will be 2 more Democratic senators voted in. And a 50-50 deadlock in the Senate is broken by VP Harris. Not voting is bad strategy.",tweet,"Desantis. Not even close. I don't think Trump is electable, for one. If he wasn't able to win as an incumbent against Biden, he isn't going to win in 2024. He's also just too divisive at this point. He won't get anything done, short of enacting executive orders.",reply,"I would hope that Republicans and Democrats are also anti-violence, so I'm not sure what your point is? Libertarians are about self-reliance, though. Owning a firearm for self-defense is part of self-reliance, especially now after you've got dems calling for defunding police.🙄",tweet,"This isn't a new thing. 🙄 H. Clinton was elected senator after only being MARRIED to a president for 8 years. Obama was elected president after being a JUNIOR senator in Illinois for less than 1 term. Trump was elected after only being a PT businessman &amp; reality TV ""star.""",reply,"Yep. Even if you recognize the craziness and instability of the Trump years, it's still ok to be unhappy with the way our country is currently being governed.🙄 Biden is obviously cognitively impaired and the Dems are spending our country's money like it's monopoly money.",reply,"@KamalaHarris Nope. I didn't vote for Trump either time. I voted 3rd party. I'm not a fan of Trump, Clinton or Biden. But that's obviously your go-to defense - ""But Trump did something that was far worse."" Trump has nothing to do with Kamala being an actual political whore. Both are awful.",reply,"Dear God, anyone is better than Trump. I still can't believe that he was elected in 2016. I voted 3rd party in the last 2 pres elections, because I just couldn't convince myself to vote for either of the major 2 candidates. The U.S. is just a hot mess right now...",reply,"I'm sure that as much as he hates Trump, Romney realizes that his support will evaporate among his Mormon constituency in Utah if he opposes installing another conservative justice prior to the election. It's not exactly complicated...",reply,"This! I can't believe the number of people who rip on all of the people who supported Trump (not without merit) and then completely ignore the fact that they themselves voted for Biden. Come on. We replaced a narcissistic reality TV ""star"" with a cognitively disabled old man.🤣",reply,0,,,,,,,,,,
Oneiorosgrip,"@jaketapper As a libertarian, I can't decide who is worse. The Republicans who are blindly following the Orange Man and justifying his comments &amp; actions or The Democrats who ignore the stupid comments &amp; actions of members of their own party by claiming that they're not as bad as Trump.🤣",reply,"Looking into it is one thing. How many challenges has Trump actually won? If the GOP doesn't vote in January as some kind of protest, there will be 2 more Democratic senators voted in. And a 50-50 deadlock in the Senate is broken by VP Harris. Not voting is bad strategy.",tweet,"Desantis. Not even close. I don't think Trump is electable, for one. If he wasn't able to win as an incumbent against Biden, he isn't going to win in 2024. He's also just too divisive at this point. He won't get anything done, short of enacting executive orders.",reply,"I would hope that Republicans and Democrats are also anti-violence, so I'm not sure what your point is? Libertarians are about self-reliance, though. Owning a firearm for self-defense is part of self-reliance, especially now after you've got dems calling for defunding police.🙄",tweet,"This isn't a new thing. 🙄 H. Clinton was elected senator after only being MARRIED to a president for 8 years. Obama was elected president after being a JUNIOR senator in Illinois for less than 1 term. Trump was elected after only being a PT businessman &amp; reality TV ""star.""",reply,"Yep. Even if you recognize the craziness and instability of the Trump years, it's still ok to be unhappy with the way our country is currently being governed.🙄 Biden is obviously cognitively impaired and the Dems are spending our country's money like it's monopoly money.",reply,"@KamalaHarris Nope. I didn't vote for Trump either time. I voted 3rd party. I'm not a fan of Trump, Clinton or Biden. But that's obviously your go-to defense - ""But Trump did something that was far worse."" Trump has nothing to do with Kamala being an actual political whore. Both are awful.",reply,"Dear God, anyone is better than Trump. I still can't believe that he was elected in 2016. I voted 3rd party in the last 2 pres elections, because I just couldn't convince myself to vote for either of the major 2 candidates. The U.S. is just a hot mess right now...",reply,"I'm sure that as much as he hates Trump, Romney realizes that his support will evaporate among his Mormon constituency in Utah if he opposes installing another conservative justice prior to the election. It's not exactly complicated...",reply,"This! I can't believe the number of people who rip on all of the people who supported Trump (not without merit) and then completely ignore the fact that they themselves voted for Biden. Come on. We replaced a narcissistic reality TV ""star"" with a cognitively disabled old man.🤣",reply,0,,,,,,,,,,
PESTRiCA,"We can't contain the excitement for 's first full-color images! On Monday, July 11 at 5pm ET (21:00 UTC), President Biden will unveil one of the space telescope's first images of deep space as a preview of what's ahead:",retweet,"Not feeling well today. _(:3」∠)_ Oil change tomorrow (already sent off my vote, so no worries about that. ha.). Was going to get takeaway, but realized they're closed. Then more driving &amp; doing as the week goes on. &amp;... maybe grocery pick up? Not sure.",tweet,"As we hurtle towards the end of Early 2022, a quick Playdate update: Group One's batch of brand new shiny Playdates are on their way to our fulfillment center in California as we speak!! They'll still need to be processed (and gradually shipped) but… it's almost time!",retweet,"While we didn’t vend at MFF, our team WAS there to have some fun. Current status is: crying in our hotel room after seeing.. SO much of what we do, proudly displayed on your beautiful figures. Walking the halls and seeing every 7th person wearing us is just.. it’s overwhelming.",retweet,"Oh man, this slow cooker mac &amp; cheese &amp; meat is just ~too cheesy~ &amp; bland. (but, a lot of them are.) Have to mess with this if I want to do it again, I guess. :d But, it's also pretty easy to just make a roux to white sauce &amp; put cheese in it either. ha.",tweet,"Hello, all! We were able to move the database successfully and everything should be running along smoothly now! There was a period of time where the site was up but the databases were still in a state of crossover, so there were some hiccups with quests and items at the time. 1/n",retweet,Did get the PS5 hooked up &amp; may try playing something in a bit. Happy to have it &amp; happy it worked &amp; wasn't a box of wood. (should probably gulp down some anti-nausea pills. ha.),reply,"Really, I don't know if there are other ending to get, but the way the game mechanics work, I could at least have a different path to the end, I think. And I could bring other people along too? hm. Maybe I'll try choosing all of the idiot responses? Or be more cocky? haha.",reply,"Also groceries. Should have went day 1 but look at the deals! Cheap beyond &amp; a $1 pizza (with part of a bag of $2 Miyoko's). Should have let it melt a bit more, but I was hungry. Not bad, even though I had to cook it in foil (as I didn't want the possibility of cleaning an oven)",reply,GODZILLA WAS A JURASSIC CREATURE THAT EVOLVED FROM A SEA REPTILE INTO A TERRESTRIAL MONSTER AWAKENED BY MANKIND'S NUCLEAR WEAPONS TESTS. OVER TIME GODZILLA ITSELF HAS EVOLVED AND ITS FELLOW KAIJU MONSTERS HAVE COME TO EMBODY THE EMOTIONS AND SOCIAL PROBLEMS OF OUR TIMES!,retweet,0,,,,,,,,,,
PESTRiCA_R,"We can't contain the excitement for 's first full-color images! On Monday, July 11 at 5pm ET (21:00 UTC), President Biden will unveil one of the space telescope's first images of deep space as a preview of what's ahead:",retweet,"Not feeling well today. _(:3」∠)_ Oil change tomorrow (already sent off my vote, so no worries about that. ha.). Was going to get takeaway, but realized they're closed. Then more driving &amp; doing as the week goes on. &amp;... maybe grocery pick up? Not sure.",tweet,"As we hurtle towards the end of Early 2022, a quick Playdate update: Group One's batch of brand new shiny Playdates are on their way to our fulfillment center in California as we speak!! They'll still need to be processed (and gradually shipped) but… it's almost time!",retweet,"While we didn’t vend at MFF, our team WAS there to have some fun. Current status is: crying in our hotel room after seeing.. SO much of what we do, proudly displayed on your beautiful figures. Walking the halls and seeing every 7th person wearing us is just.. it’s overwhelming.",retweet,"Oh man, this slow cooker mac &amp; cheese &amp; meat is just ~too cheesy~ &amp; bland. (but, a lot of them are.) Have to mess with this if I want to do it again, I guess. :d But, it's also pretty easy to just make a roux to white sauce &amp; put cheese in it either. ha.",tweet,"Hello, all! We were able to move the database successfully and everything should be running along smoothly now! There was a period of time where the site was up but the databases were still in a state of crossover, so there were some hiccups with quests and items at the time. 1/n",retweet,Did get the PS5 hooked up &amp; may try playing something in a bit. Happy to have it &amp; happy it worked &amp; wasn't a box of wood. (should probably gulp down some anti-nausea pills. ha.),reply,"Really, I don't know if there are other ending to get, but the way the game mechanics work, I could at least have a different path to the end, I think. And I could bring other people along too? hm. Maybe I'll try choosing all of the idiot responses? Or be more cocky? haha.",reply,"Also groceries. Should have went day 1 but look at the deals! Cheap beyond &amp; a $1 pizza (with part of a bag of $2 Miyoko's). Should have let it melt a bit more, but I was hungry. Not bad, even though I had to cook it in foil (as I didn't want the possibility of cleaning an oven)",reply,GODZILLA WAS A JURASSIC CREATURE THAT EVOLVED FROM A SEA REPTILE INTO A TERRESTRIAL MONSTER AWAKENED BY MANKIND'S NUCLEAR WEAPONS TESTS. OVER TIME GODZILLA ITSELF HAS EVOLVED AND ITS FELLOW KAIJU MONSTERS HAVE COME TO EMBODY THE EMOTIONS AND SOCIAL PROBLEMS OF OUR TIMES!,retweet,0,,,,,,,,,,
PamHarbinPGH,"If we beat Trump and flip the Senate, we can: -End the filibuster. -Make D.C. a state. -Pass public financing. -Restore the Voting Rights Act. -Require presidential tax disclosure. -Make Election Day a federal holiday. Reclaim our democracy. 🇺🇸",retweet,I’m going to ask this question and I want a Bernie supporter who is not going to vote for Joe Biden to answer it: why don’t you guys spend as much time railing against Donald Trump as you do centrist Democrats? I’m dead serious. Why. He’s the most horrible thing ever. Answer.,retweet,"RETWEET if you agree that American media has an absolute journalistic obligation not to repeat or report on COVID-19 disinformation spread by Trump to influence early voting and the election, including and most particularly false claims regarding when a vaccine will be available.",retweet,"Barr said: ""The problem with the testing system was a function of Obama's mishandling of the CDC."" Trump ELIMINATED the virus task force Obama created. Trump CALLED COVID A HOAX and said it would ""disappear like magic in a few days."" Since then, 140,000 Americans have died.",retweet,"DOW drops 2000 points in one week. The stimulus is wearin' off and the #TrumpRecession is in full bloom. Trump's COVID ""strategy"" is killin' Americans and our economy.",retweet,"With this move, Republican senators have stopped merely being enablers when Trump seeks foreign help to win elections. They’ve become accomplices.",retweet,"Insider says Kushner is now in charge of planning last ditch try at disqualifying Biden ballots on election night, urging Republican state legislatures to ""send competing slates of electors,"" and then seeking a Supreme Court ruling in Trump's favor. Barr is said to support this.",retweet,"Joe Biden kicked ass. The country knows we need capable public servants w a plan to use our tax dollars &amp; their power for the people 5 states moved to Dems: PA, MI, WI, AZ, GA 78M people defeated Republicans but we only get the change if we boot Mitch",retweet,"BREAKING: WH official says masks will continue to not be mandatory at the WH, even after Trump tested positive. Saying it’s a “personal choice.” They won’t even try to protect themselves, they definitely can’t protect us. We need new leadership. Vote for Biden-Harris.",retweet,"I complained about the way @nbc erased @ewarren throughout the primary, particularly after she took the national lead in October. Erased! And now folks are pissed that they’re giving Trump his own town hall during Biden’s event. After Trump refused to debate. NBC is just awful.",retweet,0,,,,,,,,,,
PaulIngrassia,"Take a civics class. DeSantis has a republican legislature. Trump was fighting democrats and republicans in congress AND the senate. But while DeSantis was in congress and in DC, he voted against the wall twice and voted for TPP. He did a lot, I'd say🤣",reply,"How is stating a fact chasing anyone? You're aware Kansas has NEVER elected a democrat Governor while a Dem was President, right? Guess what? They just did in November. The same state that voted against their abortion referendum. Yes, it matters.",reply,"K Abrams was about 1,000x worse than Biden and people know Biden can't pass most things without the house and senate lol. These aren't comparable. I'll ""show up"" on election day and vote down ticket Republican and write in someone for President. Just like neocons did with Trump.",reply,"He's a weak candidate because of his Congressional record. He will not win AZ considering his stance on social security He won't win PA because he's anti fracking and a climate changer Also, is he like Trump or is he not? Because if he is, why would independents vote for him?",reply,? They haven't even liked each other since 2020 when Massie voted against the stimulus package while Trump was worried about winning elections.,reply,"No, but these people (not REP) are delusional. Democrats overwhelmingly vote for their candidate no matter what. Republicans have an identity crisis between America First candidates and squishy Republicans, which unfortunately leads to MAGA voters and/or moderates not voting.",reply,"Lol, every single thing you named was voted on by congress and the senate EXCEPT infrastructure because democrats refused to bring it to a vote under Trump. So thank you for admitting it's congressmen and senators that suck, which we've been saying for years.",reply,"Trump will be the last GOP candidate I ever vote for until they get their shit together. The GOP has done nothing the past two years except ignore their voters and help democrats pass red flag laws, climate change bs, billions to ukraine, and now talking about amnesty.",reply,"Laura's not in DC first of all.. Secondly, what have you got out of voting republican lately? Codifying gay marriage? Spending billions to ukraine? Passing gun legislation? Approving their climate change bs? Approving Bidens Supreme Court justice?",reply,"I know McConnell is the Senate, but thank God he continues to show us how fucking useless voting for the GOP is. This party is beyond dead without Trump.",reply,0,,,,,,,,,,
