TweetID,Tweet1,Type1,Tweet2,Type2,Tweet3,Type3,Tweet4,Type4,Tweet5,Type5,Tweet6,Type6,Tweet7,Type7,Tweet8,Type8,Tweet9,Type9,Tweet10,Type10,Rated,P1,C1,P2,C2,P3,C3,P4,C4,P5,C5
johnpavlovitz,"On the left, Republican Senator Mike Lee feigns outrage during the State of the Union when President Biden suggests that some Republicans want to cut Social Security and Medicare. On the right, Mike Lee says he wants to get rid of Social Security, Medicare, and Medicaid.",retweet,"Donald Trump did not invent any of these present national cancers of violent white nationalism, rampant homophobia/transphobia, and anti-Science conspiracy. What he did, was normalize them and made people proud of their ugliness.",tweet,"Meanwhile, Republicans are condemning socialism, targeting people of color in Congress, attacking a cancer patient's headwear, and banning books... #JobsReport",quote,House Republicans's priorities: 30% sales tax Hunter Biden Ilhan Omar Gas stoves Woke M &amp; Ms AP African American History Socialism CRT What ever happened to fighting inflation?,retweet,"Every Republican elected official needs to be asked and must give an answer: do you support a “national divorce” aka a civil war? One word answer, no misdirect, not “this is what the media always does.” Do you agree with the leader of the party, MTG",retweet,Republicans are livid because The Biden Administration wanted to ensure people would not be harmed with the shooting of the Chinese balloon. Preventing casualties isn’t in the GOP’s mindset. They prefer to manufacture injury.,tweet,"You would hope—though many voted for Trump twice and would so again, even after seeing everything he and his party have done to harm them. It's hard to fathom.",reply,"Biden has turned over every single document willingly. Trump refused for months leading to the FBI searching his house. Trump is guilty, Biden is not.",retweet,".@Jim_Jordan—who hasn’t paid a single *ounce* of attention to the train derailment disaster in Ohio despite being a representative OF THE STATE—is accusing Biden of ignoring the crisis there. Hey Jim, did you know that this crisis was a result of Trump’s ‘historic deregulations’?",retweet,"Where are all of you who said they’d give Garland until last spring, then summer, then after election, then beginning of this year, to indict Trump &amp; accomplices, before you’d begin calling out the DoJ/AG for lack of accountability? What’s your new approximate date this time?",retweet,0,,,,,,,,,,
rmasher2,"President Biden made a powerful, passionate speech last night urging Congress to do something to end the epidemic of mass shootings &amp; gun violence in this country. Democrats will do something. And Republicans will kill it in the Senate. Same as it ever was. #Enough #GunReformNow",tweet,@SpeakerPelosi The House narrowly passed a bill in May that would crack down on price-gouging by oil &amp; gas companies. Speaker Pelosi voted for it. President Biden said he would sign it into law. But every Republican voted against it &amp; it will die in the Senate due to unified GOP opposition.,reply,"Republicans have made no secret about their plans if they take over the House in 2023, and it won't be legislation. It will be revenge &amp; retribution 24/7. Democrats impeached Trump? Republicans will impeach Biden. What for? It doesn't matter. Anything will do. #VoteBlue2022",tweet,"It keeps happening. A Republican president tanks the economy. Voters elect a Democratic president to clean up the mess. And Republicans sit on the sidelines blaming Democrats for not cleaning up their mess fast enough. It happened with Clinton, Obama &amp; now Biden. #VoteBlueIn2022",tweet,"Maybe the spouse of someone who tried to overthrow the government and install Trump as POTUS shouldn’t sit on the Nation’s Highest Court? Or if he did, he shouldn’t be permitted to block an investigation into the effort to steal the election? #ImpeachClarenceThomas",retweet,"Follow &amp; support @TimRyan for US Senate in #Ohio. He is a great candidate who can pick up that seat for Democrats. He will support voting rights, gun reform, and he will fight for women. He will not choose the filibuster over President Biden’s agenda! #FreshWords #FreshVotesBlue",retweet,"George Santos: ""Look at Joe Biden. Joe Biden has been lying to the American People for 40 years... Democrats resoundingly support him. Do they have no shame?"" Replace Biden with Trump &amp; Democrats with Republicans, and that would be the truest statement Santos ever uttered.",tweet,The Republican Party as it is currently constituted - the Party of Trump - doesn't believe in free &amp; fair elections. They don't believe in democracy. So why would anyone voting in a democratic election vote for an anti-democracy Republican? It makes no sense. #VoteBlueIn2022,tweet,"69% of Republicans still believe Trump won the 2020 election &amp; that Biden is not the legitimately elected President. WITHOUT A SHRED OF EVIDENCE. More than 2 out of 3 Republicans are completely lost to facts, reason &amp; reality. #Sad #RIPGOP #VoteBlue2022 #VoteBlueToSaveAmerica",tweet,"Democrats continue to pass legislation that helps all Americans. Just think what we will do if we retain the house and add senators. The vindictive, fascist, and lying Republicans only want to keep Americans from realizing health and happiness. VOTE BLUE!",retweet,0,,,,,,,,,,
GfreemanHl3,"After terrorist assholes hit the World Trade Center, 2,606 people died. The country came together: Democrats AND Republicans. Now 57% of Republicans call 176,000 dead from COVID-19 ""acceptable losses?"" What happened to you, America?",retweet,"I’m the 1st Democrat to ever face Nancy Pelosi in a general election. I ran for Congress b/c she paved Trump’s path while mouthing resistance. She’s out raised us 15:1. Can you help level the field? Our avg donation is $21. Donate, RT, like, and reply!",retweet,@realDonaldTrump It was only after social media users kept retweeting videos of him shooting two protestors in the head that the police even cared about what happened. White militiamen and right-wing paramilitary agitators are murdering American citizens in cold blood. This is Trump’s America.,retweet,Trump’s proposal to permanently terminate the payroll tax could defund Social Security and eliminate benefits for senior citizens and people with disabilities in &lt;4 years. That’s not Bernie Sanders talking. That’s what the Social Security Administration recently reported to us.,retweet,As Hollywood millionaire$ shame voters for not supporting the corrupt politician who made Trump possible instead of pressuring Joe Biden &amp; democrats to offer voters ANYTHING to vote FOR-The DNC Just Voted Down Legalizing Pot &amp; Healthcare For Poor People.,retweet,"Hot take: Trump getting re-elected would NOT be better for the leftist movement, than Biden winning in November.",retweet,"LMAO. Joe Biden tells a Trump supporter standing on a truck, ”Don’t jump.”",retweet,"My response when they say, ""You do realize that it's harder to demand basic human rights under a fascist right?"" to get you to vote for Joe Biden: We were denied basic human rights under Bill Clinton, George W. Bush, Barack Obama. Thank you, next.",retweet,"More liberals unfollowing me. A lot of them have #Resist in their bios. Y’all can all unfollow me right now. I don’t need your desperate ignorance. If you’re one of those people who feel compelled to vote for Biden and also shame others who choose not to, fuck off.",tweet,"“Police are paid w/taxpayer $$$. If they are not answerable to us, we can demand new service &amp; that’s what this is. #AbolishThePolice in favor of that new service” A nuanced explanation of brand new paint on #BLMPlaza Night before #MarchOnWashington #MOW2020 #DCProtests",retweet,0,,,,,,,,,,
Sobyvee,"PJ O'Rourke once quipped that ""The Republicans are the party that says government doesn't work and then they get elected and prove it."" But conservative parties have unlikely allies in the project to discredit public service: neoliberal ""centrist"" parties, like . 1/",retweet,"I am not an American, but I lived in the U.S for almost 10 years. From my experience, I can say the mainstream higher education in the U.S is pro-imperialism, and normalizes bias and hatred against Asians/Asian-Americans and socialist Asian countries 🙏.",retweet,100% this! Where is the political will to actually take care of those being disabled by this virus @POTUS ? It's so frustrating that millions of people are just being left behind bc governments and medical boards are too afraid/incompetent to act!,retweet,The Netanyahu government’s assault on democracy has been met by little-to-no pushback by American Jewish organizations.,retweet,"Neofeud is anti-capitalist, anti-racist &amp; anti-imperialist cyberpunk. I'm a Native Hawaiian who made this game while working 40+ hrs in social services / teaching in ghettos, while homeless. Neofeud is my life, in art. Thread 1/?",retweet,Self dx/identification of autism It doesn’t matter what people on Twitter say. You can know you’re autistic without a doctor telling you. These people exist as tiny circles on social media. You don’t have to plant them in your brain.,retweet,"""Infection linked to nearly 43% increase in autoimmune disease risk..."" We've been on the receiving end of a massive gaslighting campaign to normalize mass reinfections of this dangerous virus. Take care of yourself, prevention trumps all else.",retweet,"Quick disambiguation: I generally stay away from personas, the focus is on understanding what the person is looking for. I use zones of trust, essentially start people in outer zones where I will only allow very sanitized information.",reply,"I don't know what's better, Queen Elizabeth dying or the taste of these white tears shed by triggered liberals as they watch their vaunted hero get trolled for the colonialist and imperialist she always was.",retweet,Takes a lot of chutzpah to undermine publicly funded care and then announce that private clinics owned or operated by your political donors and cronies are the solution to the #HealthCareCrisis. Privatization of healthcare in Canada is harmful to everyone. #onpoli #OntarioHealth,retweet,0,,,,,,,,,,
abby4thepeople,"5/8 As Eugene Debs so aptly noted, ""The Republican and Democratic parties, or to be more exact, the Republican-Democratic party, represent the capitalist class in the class struggle."" But we must remember that ""The most potent force in the working class is class consciousness.""",retweet,"At some point organized labor is going to need to discuss whether we're going to be a democratic, bottom up organization or if we're going to continue the facade while we have king makers and more appointed staff than elected. I don't expect likes but most of you know it's true.",retweet,"79 years ago today in Chicago: the US government took over retail giant Montgomery Ward &amp; physically ejected the company's millionaire chairman, Sewell Avery, after he defied an order from the National War Labor Board to recognize his workers' democratically elected union.",retweet,idk y'all I just have this weird feeling that the government that makes it its business to topple every socialist government they can get their hands on isn't going to let us vote a socialist into office,tweet,"I don't give a shit what ""union joe"" or any liberal says, ACAB always. The police are nothing but a hammer for capitalism. As NWA said, Fuck the Police!",retweet,BREAKING: The first Apple store in the United States has filed for a union election with the Communications Workers of America. The Atlanta store could be the first of Apple’s 272 brick-and-mortar stores to unionize.,retweet,"There are now 7 unionized Starbucks stores, including one in Seattle. The union just ran the table, winning 9 'yes' votes to zero 'no' votes. has won 7 of their first 8 union elections, with around 140 other election petitions in the hopper.",retweet,"except that the 4 million residents of these territories can't vote or have representation in government because the Supreme Court found that they ""belonged to the United States but were not a part of the United States""",reply,"This leads to adults that base all of their politics off of whether or not someone is pro-life, this is what we're up against",reply,I am literally begging the democrats to get their shit together before they get Trump reelected,tweet,0,,,,,,,,,,
realstevetrev,"So the republicans go to court in Pa. wanting to have their people watch the vote counting, the democrats go to court trying to block them. Why not install cameras and put it online so we can all watch? There are those bored enough to watch.",tweet,Should the New Jersey Senate President post the bill that would have the powers that be vote on whether residents can have the choice of pumping their own gas?,tweet,Is President Trump putting lives at risk by not cooperating with the Biden transition team on the coronavirus? 1-800-283-1015 come tell me your thoughts on this on .,tweet,Should Trump continue to challenge the election? 1-800-283-1015 let me know what you think on .,tweet,"@OANN Hey Stan, Happy New Year. If the President of the United States wants to go on national television in the middle of a Capital protest to implore them to leave and they don't put him on, it's on them. #irresponsible",reply,"If President Trump set up with his own television/social media network, would you subscribe to it? 1-800-283-1015 let me know if you would on .",tweet,Should Donald Trump be indefinitely suspended from social media? 1-800-283-1015 let me know what you think on .,tweet,"Despite the rejection of Democratic Senate leaders, should there be an investigation into the New Jersey nursing home deaths at the beginning of the coronavirus pandemic?",tweet,Should President Trump's account be reinstated on Twitter?,tweet,"Republicans and Democrats laughing together? It happened in N.J., and we’re not joking! -",tweet,0,,,,,,,,,,
stellar_mermaid,"Today, I will ask that the Senate vote yes or no on two bills: 1. The House passed $2,000 survival checks 2. Mitch McConnell’s alternative bill What objection could he possibly have to voting on his own bill? Let the Senate vote on $2,000 checks, Mitch!",retweet,so many problems in american politics stem from the fact that america is probably the only country on earth where people think it's totally ok for the government to not improve their lives in any meaningful way,retweet,"To Republicans suddenly worried about a divided country, I hope you start by joining together as a party and saying in one voice: Joe Biden won a fair election.",retweet,"Since Trump’s almost out of office, I figured this would be a fun time to remind everyone of the weirdest &amp; dumbest sh*t our failed dictator did in the last four years that we totally forgot about. Starting with a classic: STARING DIRECTLY INTO THE SUN DURING A SOLAR ECLIPSE",retweet,I wish our country would care about its ppl. We’re stuck with rich whiny babies who only care about themselves and money. I hate how they are so old and don’t give a f about anybody but themselves. Where’s our 2k they were so disgusted the trump admin didn’t give us?,tweet,White conservatives and liberals alike CAN EAT THIS,retweet,"Today is 18 yrs of the US invasion/illegal occupation of Iraq Listen to this Iraq War Veteran ""We've been to Iraq, We've been to Afghanistan, We know what these wars are really about. Our enemies are not in the poorest countries on the planet but right here in the richest one.""",retweet,Right? They’ll just stick to selling confederate and trump flags for ever and somehow make a living off of them 😂😂,reply,How is it the same as Q anon? That’s a weird statement like not being able to judge your president sounds like Q because they worshipped trump,reply,Either her and Ted Cruz are pretending or they are literally not smart enough to be governing states. What’s wrong with our country lol,tweet,0,,,,,,,,,,
ColtonVanVoorhi,"For 4 years the news media went after Trump’s children on a daily basis. But they give Biden’s son, Hunter, who’s a real-life crackhead, who married his dead brother’s widow, and who has an illegitimate child with a stripper, a pass? Make it make sense. 🇺🇸🇺🇸",retweet,Joined President @realDonaldTrump in the Situation Room last night upon reports the Islamic Republic of Iran had launched missiles on U.S. military facilities in Iraq. America is safer and stronger because of President Trump's decisive action. 🇺🇸,retweet,"Great news week for the President: -Eliminated Soleimani -New sanctions on Iran -140k more jobs this month -Dow clears 29,000 -Court allows $3.6 billion for the Wall No wonder Pelosi announced she’ll finally send the articles to the Senate.",retweet,"This is the exact moment where JD Vance won the Ohio Senate seat. It’s over. And it only took 30 seconds. You will never see a more 🔥 response, then brutal reversal in politics.",retweet,Ohio State will be going up against one of the nations best defenses Saturday night. Michigan St is No. 7 in the nation in Total Defense. Top Defenses in CFB (Total Defense) 1. Wisconsin 2. Ohio State 3. Missouri 4. TCU 5. Iowa 6. Navy 7. Michigan St 8. Clemson 9. UGA 10. Oregon,retweet,"It is statistically impossible to “find” 130,000 votes and have every single one of them be only for Biden.",retweet,"Love him or hate him, you can’t argue that Trump loves this country. Merica.",retweet,"Since when can a President sign an Executive Order that nullifies an Amendment? I thought this was a Democracy, not a Dictatorship. F🇺🇸ck gun control &amp; F🇺🇸ck Joe Biden.",retweet,I would have this playing non-stop. What disrespect. Just a reminder in case they forgot. Jim Harbaugh is now 1-5 against Ohio State. Ohio State is 8-2 during the last 10 matchups. Ohio State is 17-3 during the last 20 matchups,retweet,"Like him or hate him, you can’t argue that Trump loves this country. 🇺🇸🇺🇸",retweet,0,,,,,,,,,,
RedWaves__,"trump really said ""I'm the least racist president. I'm the least racist person in this room"" and then proceeded to call Mexican parents ""coyotes""................#Debates2020 #DebateTonight",retweet,"Y’all don’t understand that Donald Trump is a puppet of the upper elites....just like Obama, that man has no power this all part of the new world order plan to decrease the human population.",quote,FREE MEEK MILL. FUCK DONALD TRUMP &amp; HIS SUPPORTERS WINK WINK 😉,retweet,"THIS IS CHILE RIGHT NOW. The government set the military on the streets just because people were demanding rights. Salaries aren’t enough. WE ARE A DISARMED COUNTRY. They fight us with guns and we have bare hands. Media is censoring this, please RT. MAKE THE WORLD SEE.🇨🇱🇨🇱",retweet,"Y'all NEED to sign this petition for the ""Hands Up Act."" It basically will sentence officers to 15 years in prison for shooting someone who is UNARMED. Ik alot of y'all don't like what police officers are doing to US and this is YOUR chance to make a difference!!!",retweet,"Hope y’all know this man is getting re-elected. Know why? Cause every single old white folk gonna be at them polls, while the younger generation sits on the couch tweeting about it as if retweets go into the ballot box. y’all want change? Educate yourselves and VOTE",retweet,"50 Cent, Ice Cube, Kanye West, Lil Wayne (Weezy) and all the others endorsing Trump. Malcolm :",retweet,"The events of the past week are in no way a reflection on that service and sacrifice. I’ll ask each of you to reach out to an Afghanistan veteran and talk about their time, and let them know that you are proud of them. Just as I am.",retweet,That’s cool and all but what are you going to do about police brutality against innocent African-American men and women 🤔🤨,quote,If i don’t get paid on the first Trump or who ever gotta see me with the hands man i have bills to pay....,quote,0,,,,,,,,,,
Relax_itstiff,"greatest lesson i've ever learned is that sometimes people have to learn on their own terms, on their own time, in their own experiences. can't lose your mind tryna help someone see what you see even if it's with the purest intentions. speak your truth &amp; let them do what they do.",retweet,"Introverts don't fit in. They kinda like to be in their own world. Quiet world. Cosy world. A world full of love &amp; good vibes. A world of meaning and deep contemplation. They like to be alone not because they are anti-social, but because they don't need people to feel fulfilled.",retweet,Following women on social media who don’t align with the Eurocentric beauty standards&gt;&gt;&gt; for my woc pls do this and i promise you it’ll make you embrace and fall in love with your features more &lt;3,retweet,Y’all gas up Philly too much like it isn’t all that fun here fr. Too much shit be going on &amp; it’s like death is always in the air. Swear y’all only wanna hype it up cause of what y’all see on social media.,tweet,"social media breaks will remind you that a lot of this shit doesn’t even deserve a reaction all the time. conserve that energy for creativity, community, love, exploration, etc.",retweet,"No literally. 😂😂and this should be big new, but they’re worried about tiktok. like we’re bouta lose our power completely, we’re deemed a third-world country, &amp; our currency is gonna be dust. Our economy is gonna crash and it’s right in our faces rn",reply,"I understand both sides because when u start dating someone, it’s like they’re all that u think about and u always wanna be around them, but ur friends shouldn’t be neglected in the process &amp; if a man is keen on isolating u to the point where u have no friends, he’s the problemmm",reply,"If that man can afford it then I don’t see the problem, but I was really talkin about the girls who aren’t in relationships or shitty ones that feel like they gotta tell other women what to accept &amp; not accept in their relationships 😭",reply,Tee Grizzley reveals he makes well over $200k a month from playing GTA. He created a lane for his friends that were actively in the streets to make money online with him.Says some of them are now making around $20k a month the legal way the only way💪🏾,retweet,"Like if u got the money then go right ahead, nobody cares. People start to care and make it a topic of discussion when the bbl girlies get the same body and talk badly about having a natural body. &amp; let’s not forget, literally telling another woman to get surgery too 😂😂",reply,0,,,,,,,,,,
graciekinabox,"Ted Cruz says all Democrats do is hate Trump. Not true Ted, we hate you too.",retweet,Fauci moods: Biden briefings vs. Trump briefings,retweet,Why even be in Congress if you don’t believe in doing your job? Just quit and let someone who actually gives a damn do it instead of acting like a useless piece of furniture when babies are shot with AR15s that we let teen boys impulse buy before they can legally have a beer.,retweet,20 Republicans vote against Support For Human Trafficking Victims,retweet,"Enough is enough. We must abolish the filibuster and pass gun safety legislation NOW. No one in America needs an AR-15. How many more children, mothers and fathers need to be murdered in cold blood before the Senate has the guts to ban assault weapons and take on the NRA?",retweet,"“Don’t let anybody know where you are!” Never before seen video: Nancy expresses concern to Mike Pence about his safety, all while Trump was stoking violence against Pence.",retweet,Every single Republican voted against a $35/month price cap on insulin. Every. Single. One.,retweet,"As a survivor, I am thinking about how Brett Kavanaugh and Clarence Thomas are credibly accused of having violated and harassed women and are now the ones about to deny us our right to abortion care. Abusers do not belong in public office. Period.",retweet,"""Why are we here?"" Sen. Murphy presses fellow senators in emotional speech after Texas elementary school shooting. ""I am here on this floor, to beg, to literally get down on my hands and knees and beg my colleagues ... find a way to pass laws that make this less likely.""",retweet,The now famous one-shot Julliard scene in TÁR is not only an amazing technical achievement. It’s also a fascinating instance of screenwriting. Its take on political correctness and cultural policing is more nuanced than the entire scripts of most movies today,retweet,0,,,,,,,,,,
