TweetID,Tweet1,Type1,Tweet2,Type2,Tweet3,Type3,Tweet4,Type4,Tweet5,Type5,Tweet6,Type6,Tweet7,Type7,Tweet8,Type8,Tweet9,Type9,Tweet10,Type10,Rated,P1,C1,P2,C2,P3,C3,P4,C4,P5,C5
GRNesh17,"In my opinion Trump needs to chill with the attacks on Desantis right now, our party needs to be unified especially when he’s attacking the most loved Governor on our side , we’re just trying to get through this shit show midterm election right now…",retweet,There is a way out of this democrat takeover of our country... The answer is Trump/DeSantis How do we make them see this? &amp; Make it happen?,retweet,"Georgia, The Senate is at stake. I need you to go out in droves and vote for . He will give the Peach State the America First representation that it deserves.",retweet,"Heavenly Father, We pray over our nation. We pray that You lift up a standard against the enemy, who would destroy our form of government and country. We pray that satan be bound in this effort and that those who are working with him be stopped. Amen.",tweet,Impeach Biden? H/LL no! Remove him as the fraud he is. He didn’t win the 2020 election. I’m not playing along with the charade…,retweet,"Joe Biden seems to have divorced America, his new love interest is Ukraine, Jo(k)e B'idiot should be forced to pay child support to the American people! From his personal bank accounts, make my check payable to the people of East Palestine Ohio",retweet,"Pray for our nation, especially as we look forward to elections tomorrow. Pray especially that God will raise up leaders who will stand for justice and morality, and will seek God’s will in all they do. Amen.",tweet,"“When you hear of wars and rumors of wars, do not be alarmed. Such things must happen, but the end is still to come. Nation will rise against nation, and kingdom against kingdom. There will be earthquakes in various places, and famines. These are the beginning of birth pains.”",tweet,"If he looks like a pastor/priest, and stands in the front of a church, does that mean he teaches ALL truth? Matthew 16:6 “Be careful,” Jesus said to them. “Be on your guard against the yeast of the Pharisees and Sadducees.” 1 Thessalonians 5:21 ""Prove all things....""",retweet,"Considering some institutions are still mandating the COVID shot , let’s not forget what is truly happening behind the scenes. There are over 17K doctors standing together bringing the truth to light even after many have been censored, de-platformed, and discredited.",retweet,0,,,,,,,,,,
RickMyres,Kansas votes in referendum to protect right to abortion really?? They voted to say murder of the unborn is OK? They will answer for that. Lord Jesus I pray to end this insane madness 🙏🙏🙏,tweet,"Mark 11:24-25 24 Therefore I say unto you, What things soever ye desire, when ye pray, believe that ye receive them, and ye shall have them. 25 And when ye stand praying, forgive, if ye have ought against any: that your Father also which is in heaven may forgive you yours.",tweet,A church cannot save you only Jesus can. The church is the meeting place for believers and the lost. Water baptism shows the example of what has already taken place. As in being born again by the Holy Spirit not of ourselves lest any man boast.,tweet,"This is what I'm talking about 2 Corinthians 5:17 KJV 17 Therefore if any man be in Christ, he is a new creature: old things are passed away; behold, all things are become new.",tweet,"2 Peter 2:10 KJV 10 But chiefly them that walk after the flesh in the lust of uncleanness, and despise government. Presumptuous are they, selfwilled, they are not afraid to speak evil of dignities.",tweet,"So there is no such thing as luck for God is always in control. Romans 8:28 KJV 28 And we know that all things work together for good to them that love God, to them who are the called according to his purpose.",tweet,It is sad some people think they are a Christian because of be baptized in water as I was but Jesus called my name I sincerely asked Him and was Spiritually baptized by the blood of Jesus to become born again. Thank you Jesus.,tweet,"Romans 11:22 KJV 22 Behold therefore the goodness and severity of God: on them which fell, severity; but toward thee, goodness, if thou continue in his goodness: otherwise thou also shalt be cut off.",tweet,"Jeremiah 17:9-10 KJV 9 The heart is deceitful above all things, and desperately wicked: who can know it? 10 I the Lord search the heart, I try the reins, even to give every man according to his ways, and according to the fruit of his doings.",tweet,Amen brother Marcus when I as still lost (and thought I was saved I heard plenty of sermons against luck) but one pastor quoted the scripture against luck and did not preach on it. He was not listening to Jesus for his message only his own words🫤,reply,0,,,,,,,,,,
thompsonb2569,"“But if our Gospel be hid, it is hid to them that are lost: in whom the god of this world hath blinded the minds of them which believe not, lest the light of the glorious Gospel of CHRIST, Who is the image of GOD, should shine unto them.” 2 Corinthians 4:3-4 KJV",retweet,"#Pray🧡 Dear Lord I lift up parents who are estranged from their child, and they don't know how to move forward. I thank you for intervening to heal all the scarred places and for being faithful to lead the parents to help others in their own time of need #InJesusNameAmen",retweet,"Remember Warriors.... For you will not leave in a hurry, and you will not have to take flight, because the Lord is going before you, and the god of Israel is your rear guard 🙌🔥🕎🔥⚔️⚖️ Isaiah 52:12 So much is happening that's not being reported... Saturate with God's word",retweet,"The #Science, #Ethics, and Art of Disclosing a #Dementia Diagnosis: How can health care professionals communicate the diagnosis in a way that relieves suffering and helps patients and their caregivers prepare for the future? via #Alzheimers",retweet,"Mark 8:36-37 KJV For what shall it profit a man, if he shall gain the whole world, and lose his own soul? Or what shall a man give in exchange for his soul? -Nothing is worth your soul. Come to Christ and live- #JesusIsLord #Believe",retweet,"🕊Sending Peace &amp; Blessings to each one of u as y’all come on Twitter each day to share &amp; offer support🕊 Love♥️Tammy “I know the plans I have in mind for you, declares the LORD; they are plans for peace, not disaster,to give you a future filled with hope.” ➕Jeremiah 29:11➕",retweet,"this will be the greatest blessing you will ever know. Many of these misguided souls are starved for the love of Jesus. Oh, they’ll talk a big game at first, but deep inside they are lonely little children, in need of the gospel truth. Just like we all are! Truth!",retweet,"God didn't love us because we were lovable, He CHOSE to love us. He SET His love on us and saved us through the blood of His SON. You don't love people because they're lovable, You CHOOSE to love. You don't honour people because they're honourable but because God is Honourable",retweet,"After Pilate handed over Jesus to be crucified, the soldiers took charge of Jesus. Carrying his own cross, Jesus went out to the place of the Skull (which in Aramaic is called Golgotha). There they crucified him, and with him two others - one on each side and Jesus in the middle.",retweet,"#Pray🧡🩵 Dear Lord, I lift up those who are living in the consequences of their sin, and they keep trying to fix what only you can restore. I thank you for leading them to repent and to follow you. I thank you for being God of unlimited second chances. #InJesusNameAmen",retweet,0,,,,,,,,,,
trinitysfaith,Donald Trump is delivering peace to the Middle East. Barack Obama and Joe Biden delivered pallets of cash to Iran. Remember that when you vote this November.,retweet,Sick: Nancy Pelosi tried to insert abortion funding measures into the Chinese Coronavirus response stimulus package I never want to hear that Donald Trump is politicizing this pandemic again while Democrats try this stunt This is a disgrace—Speaker Pelosi should be ashamed RT,retweet,"Socialism Sucks because it lets government pick winners and losers The false choice of “essential” or “non-essential” is tanking the economy EVERY American worker is essential We explain why, &amp; more—only on The Charlie Kirk Show:",retweet,"The Reproductive Health Act is a New York statute enacted on January 22, 2019 that expanded abortion rights and eliminated several restrictions on abortion in the state. The law received national media attention. Senate voted: January 22, 2019 Governor: Andrew Cuomo LOOK👆SNAKE🦅",tweet,"While thousands of Americans are without power because of a faulty energy infrastructure, This is your daily reminder that Joe Biden rescinded a Trump Executive Order banning Chinese involvement in our power grid. Why? 🤔",retweet,"Wow!!! NOW DO SOMETHING ABOUT THIS, THE BIGGEST OF ALL POLITICAL SCANDALS (IN HISTORY)!!! BIDEN, OBAMA AND CROOKED HILLARY LED THIS TREASONOUS PLOT!!! BIDEN SHOULDN’T BE ALLOWED TO RUN - GOT CAUGHT!!!",retweet,In 2016 elections the Media pushed their fake news to support anyone who was opposing @realDonaldTrump . The more they hated on him the more WE Loved Trump for NOT backing down! #2020 is going to be Greater in support 4 Trump. The US will rise from this Stronger than EVER! 🇺🇸✝️🦅,tweet,RT if you’re thankful Donald Trump is leading us through this pandemic and NOT Hillary Clinton!,retweet,Wow: This is what happens at Trump rallies that the media doesn’t want you to see A WWII veteran needed help getting to his seat These 2 proud Americans stepped up and carried him there Does this look the hateful crowd you hear about? RT!,retweet,"As VP, Biden and Obama fattened their wallets &amp; literally turned their backs on Obama and Biden could have saved countless black lives had they used their power to stop abortion being that more black children are dying through abortion than are being born. DoUrWrk",tweet,0,,,,,,,,,,
Dawnsorrow,"All of a sudden Mitch McConnell and Senate Republicans are worried that someone in America might get a $2,000 check ""who doesn't need it."" Funny. They had no problem giving a $1.4 billion tax break to Charles Koch and his family with a net worth of $113 billion. What hypocrisy!",retweet,"Wisconsin is just FOUR days away from electing Trump’s nightmare to the bench. He knows if Janet Claire Protasiewicz wins, his chances of throwing the election in Wisconsin are over. MAGA is literally flooding money into the race to make sure she loses. The reason is because…",retweet,"I believe every person in America is entitled to the same health care as the President of the United States—with no co-pays, no deductibles and no out-of-pocket expenses. If government-funded health care is good enough for Trump, it is good enough for all of us as a human right.",retweet,🎉 🎉 FANTASTIC NEWS! Democratic-backed Judge Janet Protasiewicz has WON the race for a Wisconsin Supreme Court seat — widely viewed as the single most important election in America this year. Her victory gives liberals a 4-to-3 majority on the court. This will not only…,retweet,I want Trump to be removed so that every 5th grader who asks “why was Mike Pence President for 2 days” hears a story about why white supremacy &amp; fascism are threats to democracy. Millions of students in the next decades will ask this question and will know to reject fascism.,retweet,"Let’s be clear: If we allow a former president to completely avoid accountability for inciting an insurrection against the U.S. government, we will be inviting it to happen all over again. Prosecute Donald Trump.",retweet,"Any man that talks like this will treat any woman like this. Doesn’t matter if you’re Republican, Democrat, or neither, this is clearly not a safe person to leave alone w/ women. Once again, the existence of a wife or daughters doesn’t make a man good. And this one is basura 🚮",retweet,"The man directly responsible for the chaos of today is Donald Trump, who has made it clear that he will do anything to remain in power – including insurrection and inciting violence. Trump will go down in history as the worst and most dangerous president in history.",retweet,Maybe cable news channels can take a tiny break from covering what Trump had for lunch to show the massive crowds of young people flooding into Nashville to demand Republicans pass gun reform.,retweet,The NRA buys off Congress. No action on guns. The oil industry buys off Congress. No action on climate. Insurance companies buy off Congress. No action on health care. Pharma buys off Congress. No action on drug prices. Money in politics is the root of our dysfunction.,retweet,0,,,,,,,,,,
OctoberFox,"@JoJoFromJerz @GOP I don’t really block, but I am quite liberal with the mute button. And it’s not even necessarily because of politics. My general attitude is that if I wouldn’t want to see somebody in real life, then I sure as hell don’t want to see their obnoxious tweets, either.",reply,"Yup. Biden just turned 80 last month. He’s still got a solid 2 decades to go before he’s 100. And it cracks me up that people always comment on his age. Trump is just 4 years younger than Biden, FFS.",reply,@JoJoFromJerz Yup. They always seem to leave that key detail out: people voted in record numbers because they wanted Trump gone. But try telling a Trump leghumper that. They don’t seem to realize that their boy isn’t exactly well-liked.,reply,"@JoJoFromJerz Ugh, YES. The “BUT THE REPUBLICANS FREED THE SLAVES” refrain needs to be retired. Like, yesterday. Also, the people who say that clearly don’t know their history. The EP was more of a strategic political and military move than an anti-racist one.",reply,"@RonFilipkowski Right?! If anyone ever calls me fat and ugly online, it isn’t “the democrats.” It comes from conservatives.",reply,@JoJoFromJerz Biden just turned 80. Trump is 76. Pence is 63. Let’s not pretend any of these nominees/possible nominees for 2024 are exactly spring chickens 😆,reply,"@OccupyDemocrats You have no room to talk about people allegedly being obsessed with Trump, considering that your entire Twitter feed is “Biden this, Biden that!” 🤡",reply,BREAKING: Donald Trump desperately sues his former right-hand man Michael Cohen for upwards of $500 million for revealing his secrets like the Stormy Daniels hush money payment — Trump claims that Cohen broke attorney-client privilege by exposing the truth and writing an…,retweet,"@RonFilipkowski Checks out: these are the same people who said “Let’s go, Brandon” because they were too chickenshit to say “F*ck you, Biden.” (Also, Musk must’ve nixed the free speech business, bc I just got a warning for not censoring the F word 🙄)",reply,"@RonFilipkowski I’m perfectly okay with not having “a Trump,” MTG.",reply,0,,,,,,,,,,
gregmortenson,"Tomorrow, President Biden will announce the withdraw all US troops from Afghanistan by September 11, 2021 on the 20th anniversary of 9/11 attack. USA now joins a long list of empires buried in Afghanistan graveyards. Why does USA avoid talking to / or asking women their thoughts?",tweet,"Why did he not support of HR1620 Violence Against Women Act VAWA stalled for nearly 3 yrs in Senate. Congress voted 244-172 to pass March 16. ~$500 million annual support for sexual assault survivors, training, advocacy, hotlines. Bozeman Haven shelter ~$160K annual support.",reply,"Offended by @POTUS President Biden ignorant remark in State of The Union speech describing upper Kunar valley, Afghanistan as 'the gates of hell'. It is a rugged, beautiful place, and the good people there are hospitable, proud, and resilient like no other. An apology is in order",tweet,"""Every father should remember that one day his son will follow his example instead of his advice."" -Charles Kettering Photo: Shepherd father kisses daughter in Helmand province, Afghanistan. (c) Anja Niedringhaus, AP journalist killed in Khost, Afghanistan during 2014 elections",tweet,Thanks Wendy. Yes #Unequal. It was disheartening and disturbing the see the lack of discussion and debate about violence against women + children in the election campaign - and #VAWA reauthorization has now been stalled in Senate for two years!,reply,Thanks David. Agree 💯! Grateful for you &amp; bless all Frontline health workers! stuck in a warp where politicians get person of the year every election year no matter what. @JoeBiden @KamalaHarris 2020 @realDonaldTrump 2016 @BarackObama 2012 &amp; 2008. 2004 &amp; 2000. #COVID,reply,April is Sexual Assault &amp; Domestic Violence Awareness Month. Please 1. Support survivors 2. Push your Senator to reauthorize VAWA Violence Against Women Act stalled in Senate 3 yrs. due to patriarch politics 3. Advocate: Only 23% sexual assaults reported &lt;1% of rapists convicted,tweet,"🇮🇳 India RIP 135 teachers in Uttar Pradesh who died from COVID19, after being ordered to manage panchayat local election poll stations. The teachers asked to get COVID19 vaccines first, but received no response. Their diligence cost them their lives. Many more teachers infected.",tweet,"Afghanistan The new Taliban administration now joins the ranks of the very few countries where NO women serve in high-ranking positions in government: Azerbaijan, Armenia, Brunei, North Korea, Papua New Guinea, Saudi Arabia, Thailand, Tuvalu, Vanuatu, Vietnam and Yemen.",tweet,"@SenatorTester Does US Senate or this administration plan to prioritize re-authorization of Violence Against Women Act #VAWA - stalled since 2019 with ~$500 million critical funding at stake? Violence against women has soared during COVID pandemic, but mostly ignored by media &amp; politicians.",reply,0,,,,,,,,,,
muhannad111ksa,"Yes. Trump's not alone. Federal income taxes paid by corporations a year after his tax plan was signed into law: $0: Amazon $0: GM $0: Netflix $0: Chevron $0: FedEx $0: Eli Lilly $0: Starbucks Dr. King was right. We have socialism for the rich, rugged capitalism for the rest.",retweet,"Democrats and Republicans have problems, They put us in the middle of there fight What's coming is worse for the US So we have to move on Russia and China are the future",quote,"Saudi report threatens Trump over #JamalKhashoggi 1. Install a Russian base 2. Take oil to $200 3. Kill the petro dollar 4. Stop buying US weapons US will ""stab its own economy to death""",retweet,"#Trump message to President #Putin, Crown Prince of #Saudi_Arabia #Mohammad_bin_Salman “#MBS”✉️ I want to, but i can’t be with you guys because I will get attacked by #Washington_post, #CNN, and the #Democrats. so have fun and I wish I can be with you guys I’m so jealous",tweet,BREAKING— (thread)GOP operatives are for the first time raising the possibility that @realDonaldTrump could drop out of the race if his poll numbers don’t rebound. Over the weekend I spoke to a sample of major players; one described Trumps current psyche as “fragile.” I’m,retweet,For sure we will have a long discussion Because I like republican you like democrat,reply,When Obama was the president Fox news was the fake news And now Trump is the president CNN is the fake news,reply,2 Trump knows 90% of your country are racist So in his campaign and Twitter he start saying racist stuff to get their approval When he go back to the White House everything changed and he start to act like real President,reply,"TRUMP: ""The germ has gotten so brilliant that the antibiotic can't keep up with it ... there's a whole genius to it ... not only is it hidden, but it's very smart.""",retweet,"First, I went to the Wright State University in the U.S with a full scholarship paid by my generous country. Secondly, we ""camel rider"" drive luxury cars and live in mansions that you won’t be able to afford, even in ur sweetest dreams We’re proud of our history?",reply,0,,,,,,,,,,
oliviamarie10,I think we keep thinking Biden has a chance BUT if he does look like he’s winning tonight..and let’s say they call him the winner tonight..trump gon show his ass and say there was foul play and claim there was cheating involved,reply,@realDonaldTrump of course trying to say the election is rigged but we saw that coming! If it was switched Biden would’ve taken his loss like a man. But Trump could never do that,reply,I hope all y’all understand trumps dumbass is not getting elected again..like please understand this shit lmao,tweet,It’s projected bc all the bs trump trying to pull..it’s always “projected” bc it isn’t official until January..tell that dumb ass girl Trump was “projected” but Hilary took that L instead of cryin like a lil punk..if trump flipped any two states he still couldn’t win that’s facts,reply,I just hope if Biden wins and trump shows his ass the win isn’t reversed..let’s be clear Biden wasn’t my first choice but TRUMP can never be an option,reply,@HillaryClinton really owned trump he was just as repetitive as ever..and all he said was Mexico and make America great again..basically,reply,My hometown is really something else..this lost lady just posted “Trump is still your president 🇺🇸” girl if you don’t sit yo ass down..y’all want him to stay in office so bad you’re in denial 🤣🤣,tweet,Trumps twitter page makes me hope that it is really not him tweeting the dumb shit and the blue check beside his name is fake😂 why is he such a fucking idiot,tweet,"Watching Trump &amp; Biden in side-by-side picture in this debate, makes me feel like I'm looking at picture day at a senior center... #Debates2020 #PresidentialDebate",retweet,If trump becomes president he don't have to send me back I'm sending myself back .,retweet,0,,,,,,,,,,
BarackObama,Elections matter—and we’re seeing why. Congratulations to the Biden Administration and to the American people on a COVID relief bill that will improve the lives of families across the country.,tweet,"Before their obstruction of President Obama's nominee, these six senators voted to confirm Judge Garland.",tweet,That’s why I fully support @POTUS’s call to modify Senate rules as necessary to make sure pending voting rights legislation gets called for a vote. And every American who cares about the survival of our most cherished institutions should support the President’s call as well.,reply,"If we want our democracy to function, we have to show up this election for the Governors, Secretaries of State and the candidates down the ballot who are going to protect voting rights and our electoral process. Because these seats wield a lot of power, and that power matters.",tweet,"And now, thanks to the hard work of President Biden, Senator Schumer, Speaker Pelosi, and Americans all across the country who have spent years fighting against repeal and pushing to improve the law, our starter home is starting to look pretty spacious.",reply,Senate leaders must put country before party politics. Read why it's time to give Judge Garland a vote.,tweet,"Let's celebrate Democratic candidates like , who will be Nevada’s next Secretary of State. His opponent spread conspiracy theories and lies about voting machines. Cisco will protect the integrity of Nevada’s elections.",reply,"I’m proud to endorse these outstanding Democratic candidates who will work to get the virus under control, rebuild the economy and the middle class, and protect Americans’ health care and preexisting conditions protections. Support these candidates––and vote early if you can.",tweet,"Yesterday, the House passed the John Lewis Voting Rights Advancement Act that will help Americans everywhere make their voices heard. Now the Senate needs to follow the House’s lead. Call your Senators and ask them to do the right thing. Our democracy is on the line.",quote,"If you believe in a more just, more generous, more democratic America, now is the time to fight for it. Here’s a terrific way to register voters, organize communities, and ramp up turnout in the battleground states that will decide this election:",tweet,0,,,,,,,,,,
